    [Frame: 138, payload: 0-35 (36 bytes)]
    [Frame: 139, payload: 36-304 (269 bytes)]
    [Frame: 141, payload: 36-304 (269 bytes)]
        [Segment overlap: True]
    [Segment count: 3]
    [Reassembled TCP length: 305]
    [Reassembled TCP Data [truncated]: 160303012c0c00012803001d20f03bae9a3cbab5196324cb3cc62dae20f02b734cb1610f825a4ae3f6d9b4d45c080401005fad1b71dc13969f821a65529b6bcbf792bce560845b006f290d60b08db78e9ae4f3b3b9b41e9c01e0d9898ee7eaa6eca5ac4f949a4]
Transport Layer Security
    TLSv1.2 Record Layer: Handshake Protocol: Server Key Exchange
        Content Type: Handshake (22)
        Version: TLS 1.2 (0x0303)
        Length: 300
        Handshake Protocol: Server Key Exchange
            Handshake Type: Server Key Exchange (12)
            Length: 296
            EC Diffie-Hellman Server Params
                Curve Type: named_curve (0x03)
                Named Curve: x25519 (0x001d)
                Pubkey Length: 32
                Pubkey: f03bae9a3cbab5196324cb3cc62dae20f02b734cb1610f825a4ae3f6d9b4d45c
                Signature Algorithm: rsa_pss_rsae_sha256 (0x0804)
                    Signature Hash Algorithm Hash: Unknown (8)
                    Signature Hash Algorithm Signature: Unknown (4)
                Signature Length: 256
                Signature [truncated]: 5fad1b71dc13969f821a65529b6bcbf792bce560845b006f290d60b08db78e9ae4f3b3b9b41e9c01e0d9898ee7eaa6eca5ac4f949a4150e4e5899ad3ea64306c7889c6dc91533496efb650f6d9fef8856fb89f191221bbb52142b34a05bfebc4f25d62e999f0e3e1fb71b055
Transport Layer Security
    TLSv1.2 Record Layer: Handshake Protocol: Server Hello Done
        Content Type: Handshake (22)
        Version: TLS 1.2 (0x0303)
        Length: 4
        Handshake Protocol: Server Hello Done
            Handshake Type: Server Hello Done (14)
            Length: 0

No.     Time           Source                Destination           Protocol Length Info
    140 12.016511      192.168.0.6           5.252.32.98           TCP      54     63778 → 443 [ACK] Seq=214 Ack=2999 Win=131840 Len=0

Frame 140: 54 bytes on wire (432 bits), 54 bytes captured (432 bits) on interface \Device\NPF_{9DA57E6A-DB56-483D-A9F1-101740B9C29A}, id 0
    Section number: 1
    Interface id: 0 (\Device\NPF_{9DA57E6A-DB56-483D-A9F1-101740B9C29A})
        Interface name: \Device\NPF_{9DA57E6A-DB56-483D-A9F1-101740B9C29A}
        Interface description: Wi-Fi
    Encapsulation type: Ethernet (1)
    Arrival Time: Jul 10, 2024 01:01:23.999106000 Hora estándar de Argentina
    UTC Arrival Time: Jul 10, 2024 04:01:23.999106000 UTC
    Epoch Arrival Time: 1720584083.999106000
    [Time shift for this packet: 0.000000000 seconds]
    [Time delta from previous captured frame: 0.000110000 seconds]
    [Time delta from previous displayed frame: 0.000110000 seconds]
    [Time since reference or first frame: 12.016511000 seconds]
    Frame Number: 140
    Frame Length: 54 bytes (432 bits)
    Capture Length: 54 bytes (432 bits)
    [Frame is marked: False]
    [Frame is ignored: False]
    [Protocols in frame: eth:ethertype:ip:tcp]
    [Coloring Rule Name: TCP]
    [Coloring Rule String: tcp]
Ethernet II, Src: AzureWaveTec_78:d7:21 (ec:2e:98:78:d7:21), Dst: Maxlinear_80:00:00 (00:50:f1:80:00:00)
    Destination: Maxlinear_80:00:00 (00:50:f1:80:00:00)
        Address: Maxlinear_80:00:00 (00:50:f1:80:00:00)
        .... ..0. .... .... .... .... = LG bit: Globally unique address (factory default)
        .... ...0 .... .... .... .... = IG bit: Individual address (unicast)
    Source: AzureWaveTec_78:d7:21 (ec:2e:98:78:d7:21)
        Address: AzureWaveTec_78:d7:21 (ec:2e:98:78:d7:21)
        .... ..0. .... .... .... .... = LG bit: Globally unique address (factory default)
        .... ...0 .... .... .... .... = IG bit: Individual address (unicast)
    Type: IPv4 (0x0800)
Internet Protocol Version 4, Src: 192.168.0.6, Dst: 5.252.32.98
    0100 .... = Version: 4
    .... 0101 = Header Length: 20 bytes (5)
    Differentiated Services Field: 0x00 (DSCP: CS0, ECN: Not-ECT)
        0000 00.. = Differentiated Services Codepoint: Default (0)
        .... ..00 = Explicit Congestion Notification: Not ECN-Capable Transport (0)
    Total Length: 40
    Identification: 0x458f (17807)
    010. .... = Flags: 0x2, Don't fragment
        0... .... = Reserved bit: Not set
        .1.. .... = Don't fragment: Set
        ..0. .... = More fragments: Not set
    ...0 0000 0000 0000 = Fragment Offset: 0
    Time to Live: 128
    Protocol: TCP (6)
    Header Checksum: 0xce34 [validation disabled]
    [Header checksum status: Unverified]
    Source Address: 192.168.0.6
    Destination Address: 5.252.32.98
Transmission Control Protocol, Src Port: 63778, Dst Port: 443, Seq: 214, Ack: 2999, Len: 0
    Source Port: 63778
    Destination Port: 443
    [Stream index: 7]
    [Conversation completeness: Complete, WITH_DATA (31)]
        ..0. .... = RST: Absent
        ...1 .... = FIN: Present
        .... 1... = Data: Present
        .... .1.. = ACK: Present
        .... ..1. = SYN-ACK: Present
        .... ...1 = SYN: Present
        [Completeness Flags: ·FDASS]
    [TCP Segment Len: 0]
    Sequence Number: 214    (relative sequence number)
    Sequence Number (raw): 3240811052
    [Next Sequence Number: 214    (relative sequence number)]
    Acknowledgment Number: 2999    (relative ack number)
    Acknowledgment number (raw): 3540583836
    0101 .... = Header Length: 20 bytes (5)
    Flags: 0x010 (ACK)
        000. .... .... = Reserved: Not set
        ...0 .... .... = Accurate ECN: Not set
        .... 0... .... = Congestion Window Reduced: Not set
        .... .0.. .... = ECN-Echo: Not set
        .... ..0. .... = Urgent: Not set
        .... ...1 .... = Acknowledgment: Set
        .... .... 0... = Push: Not set
        .... .... .0.. = Reset: Not set
        .... .... ..0. = Syn: Not set
        .... .... ...0 = Fin: Not set
        [TCP Flags: ·······A····]
    Window: 515
    [Calculated window size: 131840]
    [Window size scaling factor: 256]
    Checksum: 0x57ea [unverified]
    [Checksum Status: Unverified]
    Urgent Pointer: 0
    [Timestamps]
        [Time since first frame in this TCP stream: 0.540166000 seconds]
        [Time since previous frame in this TCP stream: 0.000110000 seconds]
    [SEQ/ACK analysis]
        [This is an ACK to the segment in frame: 139]
        [The RTT to ACK the segment was: 0.000110000 seconds]
        [iRTT: 0.260260000 seconds]

No.     Time           Source                Destination           Protocol Length Info
    141 12.016715      5.252.32.98           192.168.0.6           TCP      332    [TCP Spurious Retransmission] 443 → 63778 [PSH, ACK] Seq=2721 Ack=214 Win=67072 Len=278

Frame 141: 332 bytes on wire (2656 bits), 332 bytes captured (2656 bits) on interface \Device\NPF_{9DA57E6A-DB56-483D-A9F1-101740B9C29A}, id 0
    Section number: 1
    Interface id: 0 (\Device\NPF_{9DA57E6A-DB56-483D-A9F1-101740B9C29A})
        Interface name: \Device\NPF_{9DA57E6A-DB56-483D-A9F1-101740B9C29A}
        Interface description: Wi-Fi
    Encapsulation type: Ethernet (1)
    Arrival Time: Jul 10, 2024 01:01:23.999310000 Hora estándar de Argentina
    UTC Arrival Time: Jul 10, 2024 04:01:23.999310000 UTC
    Epoch Arrival Time: 1720584083.999310000
    [Time shift for this packet: 0.000000000 seconds]
    [Time delta from previous captured frame: 0.000204000 seconds]
    [Time delta from previous displayed frame: 0.000204000 seconds]
    [Time since reference or first frame: 12.016715000 seconds]
    Frame Number: 141
    Frame Length: 332 bytes (2656 bits)
    Capture Length: 332 bytes (2656 bits)
    [Frame is marked: False]
    [Frame is ignored: False]
    [Protocols in frame: eth:ethertype:ip:tcp]
    [Coloring Rule Name: Bad TCP]
    [Coloring Rule String: tcp.analysis.flags && !tcp.analysis.window_update && !tcp.analysis.keep_alive && !tcp.analysis.keep_alive_ack]
Ethernet II, Src: Maxlinear_80:00:00 (00:50:f1:80:00:00), Dst: AzureWaveTec_78:d7:21 (ec:2e:98:78:d7:21)
    Destination: AzureWaveTec_78:d7:21 (ec:2e:98:78:d7:21)
        Address: AzureWaveTec_78:d7:21 (ec:2e:98:78:d7:21)
        .... ..0. .... .... .... .... = LG bit: Globally unique address (factory default)
        .... ...0 .... .... .... .... = IG bit: Individual address (unicast)
    Source: Maxlinear_80:00:00 (00:50:f1:80:00:00)
        Address: Maxlinear_80:00:00 (00:50:f1:80:00:00)
        .... ..0. .... .... .... .... = LG bit: Globally unique address (factory default)
        .... ...0 .... .... .... .... = IG bit: Individual address (unicast)
    Type: IPv4 (0x0800)
Internet Protocol Version 4, Src: 5.252.32.98, Dst: 192.168.0.6
    0100 .... = Version: 4
    .... 0101 = Header Length: 20 bytes (5)
    Differentiated Services Field: 0x50 (DSCP: AF22, ECN: Not-ECT)
        0101 00.. = Differentiated Services Codepoint: Assured Forwarding 22 (20)
        .... ..00 = Explicit Congestion Notification: Not ECN-Capable Transport (0)
    Total Length: 318
    Identification: 0x8090 (32912)
    010. .... = Flags: 0x2, Don't fragment
        0... .... = Reserved bit: Not set
        .1.. .... = Don't fragment: Set
        ..0. .... = More fragments: Not set
    ...0 0000 0000 0000 = Fragment Offset: 0
    Time to Live: 55
    Protocol: TCP (6)
    Header Checksum: 0xdacd [validation disabled]
    [Header checksum status: Unverified]
    Source Address: 5.252.32.98
    Destination Address: 192.168.0.6
Transmission Control Protocol, Src Port: 443, Dst Port: 63778, Seq: 2721, Ack: 214, Len: 278
    Source Port: 443
    Destination Port: 63778
    [Stream index: 7]
    [Conversation completeness: Complete, WITH_DATA (31)]
        ..0. .... = RST: Absent
        ...1 .... = FIN: Present
        .... 1... = Data: Present
        .... .1.. = ACK: Present
        .... ..1. = SYN-ACK: Present
        .... ...1 = SYN: Present
        [Completeness Flags: ·FDASS]
    [TCP Segment Len: 278]
    Sequence Number: 2721    (relative sequence number)
    Sequence Number (raw): 3540583558
    [Next Sequence Number: 2999    (relative sequence number)]
    Acknowledgment Number: 214    (relative ack number)
    Acknowledgment number (raw): 3240811052
    0101 .... = Header Length: 20 bytes (5)
    Flags: 0x018 (PSH, ACK)
        000. .... .... = Reserved: Not set
        ...0 .... .... = Accurate ECN: Not set
        .... 0... .... = Congestion Window Reduced: Not set
        .... .0.. .... = ECN-Echo: Not set
        .... ..0. .... = Urgent: Not set
        .... ...1 .... = Acknowledgment: Set
        .... .... 1... = Push: Set
        .... .... .0.. = Reset: Not set
        .... .... ..0. = Syn: Not set
        .... .... ...0 = Fin: Not set
        [TCP Flags: ·······AP···]
    Window: 131
    [Calculated window size: 67072]
    [Window size scaling factor: 512]
    Checksum: 0x9de0 [unverified]
    [Checksum Status: Unverified]
    Urgent Pointer: 0
    [Timestamps]
        [Time since first frame in this TCP stream: 0.540370000 seconds]
        [Time since previous frame in this TCP stream: 0.000204000 seconds]
    [SEQ/ACK analysis]
        [iRTT: 0.260260000 seconds]
        [Bytes in flight: 278]
        [Bytes sent since last PSH flag: 278]
        [TCP Analysis Flags]
            [Expert Info (Note/Sequence): This frame is a (suspected) spurious retransmission]
                [This frame is a (suspected) spurious retransmission]
                [Severity level: Note]
                [Group: Sequence]
            [Expert Info (Note/Sequence): This frame is a (suspected) retransmission]
                [This frame is a (suspected) retransmission]
                [Severity level: Note]
                [Group: Sequence]
    TCP payload (278 bytes)
    Retransmitted TCP segment data (278 bytes)

No.     Time           Source                Destination           Protocol Length Info
    142 12.016732      192.168.0.6           5.252.32.98           TCP      66     [TCP Dup ACK 140#1] 63778 → 443 [ACK] Seq=214 Ack=2999 Win=131840 Len=0 SLE=2721 SRE=2999

Frame 142: 66 bytes on wire (528 bits), 66 bytes captured (528 bits) on interface \Device\NPF_{9DA57E6A-DB56-483D-A9F1-101740B9C29A}, id 0
    Section number: 1
    Interface id: 0 (\Device\NPF_{9DA57E6A-DB56-483D-A9F1-101740B9C29A})
        Interface name: \Device\NPF_{9DA57E6A-DB56-483D-A9F1-101740B9C29A}
        Interface description: Wi-Fi
    Encapsulation type: Ethernet (1)
    Arrival Time: Jul 10, 2024 01:01:23.999327000 Hora estándar de Argentina
    UTC Arrival Time: Jul 10, 2024 04:01:23.999327000 UTC
    Epoch Arrival Time: 1720584083.999327000
    [Time shift for this packet: 0.000000000 seconds]
    [Time delta from previous captured frame: 0.000017000 seconds]
    [Time delta from previous displayed frame: 0.000017000 seconds]
    [Time since reference or first frame: 12.016732000 seconds]
    Frame Number: 142
    Frame Length: 66 bytes (528 bits)
    Capture Length: 66 bytes (528 bits)
    [Frame is marked: False]
    [Frame is ignored: False]
    [Protocols in frame: eth:ethertype:ip:tcp]
    [Coloring Rule Name: Bad TCP]
    [Coloring Rule String: tcp.analysis.flags && !tcp.analysis.window_update && !tcp.analysis.keep_alive && !tcp.analysis.keep_alive_ack]
Ethernet II, Src: AzureWaveTec_78:d7:21 (ec:2e:98:78:d7:21), Dst: Maxlinear_80:00:00 (00:50:f1:80:00:00)
    Destination: Maxlinear_80:00:00 (00:50:f1:80:00:00)
        Address: Maxlinear_80:00:00 (00:50:f1:80:00:00)
        .... ..0. .... .... .... .... = LG bit: Globally unique address (factory default)
        .... ...0 .... .... .... .... = IG bit: Individual address (unicast)
    Source: AzureWaveTec_78:d7:21 (ec:2e:98:78:d7:21)
        Address: AzureWaveTec_78:d7:21 (ec:2e:98:78:d7:21)
        .... ..0. .... .... .... .... = LG bit: Globally unique address (factory default)
        .... ...0 .... .... .... .... = IG bit: Individual address (unicast)
    Type: IPv4 (0x0800)
Internet Protocol Version 4, Src: 192.168.0.6, Dst: 5.252.32.98
    0100 .... = Version: 4
    .... 0101 = Header Length: 20 bytes (5)
    Differentiated Services Field: 0x00 (DSCP: CS0, ECN: Not-ECT)
        0000 00.. = Differentiated Services Codepoint: Default (0)
        .... ..00 = Explicit Congestion Notification: Not ECN-Capable Transport (0)
    Total Length: 52
    Identification: 0x4590 (17808)
    010. .... = Flags: 0x2, Don't fragment
        0... .... = Reserved bit: Not set
        .1.. .... = Don't fragment: Set
        ..0. .... = More fragments: Not set
    ...0 0000 0000 0000 = Fragment Offset: 0
    Time to Live: 128
    Protocol: TCP (6)
    Header Checksum: 0xce27 [validation disabled]
    [Header checksum status: Unverified]
    Source Address: 192.168.0.6
    Destination Address: 5.252.32.98
Transmission Control Protocol, Src Port: 63778, Dst Port: 443, Seq: 214, Ack: 2999, Len: 0
    Source Port: 63778
    Destination Port: 443
    [Stream index: 7]
    [Conversation completeness: Complete, WITH_DATA (31)]
        ..0. .... = RST: Absent
        ...1 .... = FIN: Present
        .... 1... = Data: Present
        .... .1.. = ACK: Present
        .... ..1. = SYN-ACK: Present
        .... ...1 = SYN: Present
        [Completeness Flags: ·FDASS]
    [TCP Segment Len: 0]
    Sequence Number: 214    (relative sequence number)
    Sequence Number (raw): 3240811052
    [Next Sequence Number: 214    (relative sequence number)]
    Acknowledgment Number: 2999    (relative ack number)
    Acknowledgment number (raw): 3540583836
    1000 .... = Header Length: 32 bytes (8)
    Flags: 0x010 (ACK)
        000. .... .... = Reserved: Not set
        ...0 .... .... = Accurate ECN: Not set
        .... 0... .... = Congestion Window Reduced: Not set
        .... .0.. .... = ECN-Echo: Not set
        .... ..0. .... = Urgent: Not set
        .... ...1 .... = Acknowledgment: Set
        .... .... 0... = Push: Not set
        .... .... .0.. = Reset: Not set
        .... .... ..0. = Syn: Not set
        .... .... ...0 = Fin: Not set
        [TCP Flags: ·······A····]
    Window: 515
    [Calculated window size: 131840]
    [Window size scaling factor: 256]
    Checksum: 0x719d [unverified]
    [Checksum Status: Unverified]
    Urgent Pointer: 0
    Options: (12 bytes), No-Operation (NOP), No-Operation (NOP), SACK
        TCP Option - No-Operation (NOP)
            Kind: No-Operation (1)
        TCP Option - No-Operation (NOP)
            Kind: No-Operation (1)
        TCP Option - SACK 2721-2999
            Kind: SACK (5)
            Length: 10
            left edge = 2721 (relative)
            right edge = 2999 (relative)
            [TCP SACK Count: 1]
            [D-SACK Left Edge = 2721 (relative)]
            [D-SACK Right Edge = 2999 (relative)]
            D-SACK Sequence
                [Expert Info (Warning/Sequence): D-SACK Sequence]
                    [D-SACK Sequence]
                    [Severity level: Warning]
                    [Group: Sequence]
    [Timestamps]
        [Time since first frame in this TCP stream: 0.540387000 seconds]
        [Time since previous frame in this TCP stream: 0.000017000 seconds]
    [SEQ/ACK analysis]
        [This is an ACK to the segment in frame: 141]
        [The RTT to ACK the segment was: 0.000017000 seconds]
        [iRTT: 0.260260000 seconds]
        [TCP Analysis Flags]
            [This is a TCP duplicate ack]
        [Duplicate ACK #: 1]
        [Duplicate to the ACK in frame: 140]
            [Expert Info (Note/Sequence): Duplicate ACK (#1)]
                [Duplicate ACK (#1)]
                [Severity level: Note]
                [Group: Sequence]

No.     Time           Source                Destination           Protocol Length Info
    143 12.018466      192.168.0.6           5.252.32.98           TLSv1.2  147    Client Key Exchange, Change Cipher Spec, Encrypted Handshake Message

Frame 143: 147 bytes on wire (1176 bits), 147 bytes captured (1176 bits) on interface \Device\NPF_{9DA57E6A-DB56-483D-A9F1-101740B9C29A}, id 0
    Section number: 1
    Interface id: 0 (\Device\NPF_{9DA57E6A-DB56-483D-A9F1-101740B9C29A})
        Interface name: \Device\NPF_{9DA57E6A-DB56-483D-A9F1-101740B9C29A}
        Interface description: Wi-Fi
    Encapsulation type: Ethernet (1)
    Arrival Time: Jul 10, 2024 01:01:24.001061000 Hora estándar de Argentina
    UTC Arrival Time: Jul 10, 2024 04:01:24.001061000 UTC
    Epoch Arrival Time: 1720584084.001061000
    [Time shift for this packet: 0.000000000 seconds]
    [Time delta from previous captured frame: 0.001734000 seconds]
    [Time delta from previous displayed frame: 0.001734000 seconds]
    [Time since reference or first frame: 12.018466000 seconds]
    Frame Number: 143
    Frame Length: 147 bytes (1176 bits)
    Capture Length: 147 bytes (1176 bits)
    [Frame is marked: False]
    [Frame is ignored: False]
    [Protocols in frame: eth:ethertype:ip:tcp:tls]
    [Coloring Rule Name: TCP]
    [Coloring Rule String: tcp]
Ethernet II, Src: AzureWaveTec_78:d7:21 (ec:2e:98:78:d7:21), Dst: Maxlinear_80:00:00 (00:50:f1:80:00:00)
    Destination: Maxlinear_80:00:00 (00:50:f1:80:00:00)
        Address: Maxlinear_80:00:00 (00:50:f1:80:00:00)
        .... ..0. .... .... .... .... = LG bit: Globally unique address (factory default)
        .... ...0 .... .... .... .... = IG bit: Individual address (unicast)
    Source: AzureWaveTec_78:d7:21 (ec:2e:98:78:d7:21)
        Address: AzureWaveTec_78:d7:21 (ec:2e:98:78:d7:21)
        .... ..0. .... .... .... .... = LG bit: Globally unique address (factory default)
        .... ...0 .... .... .... .... = IG bit: Individual address (unicast)
    Type: IPv4 (0x0800)
Internet Protocol Version 4, Src: 192.168.0.6, Dst: 5.252.32.98
    0100 .... = Version: 4
    .... 0101 = Header Length: 20 bytes (5)
    Differentiated Services Field: 0x00 (DSCP: CS0, ECN: Not-ECT)
        0000 00.. = Differentiated Services Codepoint: Default (0)
        .... ..00 = Explicit Congestion Notification: Not ECN-Capable Transport (0)
    Total Length: 133
    Identification: 0x4591 (17809)
    010. .... = Flags: 0x2, Don't fragment
        0... .... = Reserved bit: Not set
        .1.. .... = Don't fragment: Set
        ..0. .... = More fragments: Not set
    ...0 0000 0000 0000 = Fragment Offset: 0
    Time to Live: 128
    Protocol: TCP (6)
    Header Checksum: 0xcdd5 [validation disabled]
    [Header checksum status: Unverified]
    Source Address: 192.168.0.6
    Destination Address: 5.252.32.98
Transmission Control Protocol, Src Port: 63778, Dst Port: 443, Seq: 214, Ack: 2999, Len: 93
    Source Port: 63778
    Destination Port: 443
    [Stream index: 7]
    [Conversation completeness: Complete, WITH_DATA (31)]
        ..0. .... = RST: Absent
        ...1 .... = FIN: Present
        .... 1... = Data: Present
        .... .1.. = ACK: Present
        .... ..1. = SYN-ACK: Present
        .... ...1 = SYN: Present
        [Completeness Flags: ·FDASS]
    [TCP Segment Len: 93]
    Sequence Number: 214    (relative sequence number)
    Sequence Number (raw): 3240811052
    [Next Sequence Number: 307    (relative sequence number)]
    Acknowledgment Number: 2999    (relative ack number)
    Acknowledgment number (raw): 3540583836
    0101 .... = Header Length: 20 bytes (5)
    Flags: 0x018 (PSH, ACK)
        000. .... .... = Reserved: Not set
        ...0 .... .... = Accurate ECN: Not set
        .... 0... .... = Congestion Window Reduced: Not set
        .... .0.. .... = ECN-Echo: Not set
        .... ..0. .... = Urgent: Not set
        .... ...1 .... = Acknowledgment: Set
        .... .... 1... = Push: Set
        .... .... .0.. = Reset: Not set
        .... .... ..0. = Syn: Not set
        .... .... ...0 = Fin: Not set
        [TCP Flags: ·······AP···]
    Window: 515
    [Calculated window size: 131840]
    [Window size scaling factor: 256]
    Checksum: 0x86a5 [unverified]
    [Checksum Status: Unverified]
    Urgent Pointer: 0
    [Timestamps]
        [Time since first frame in this TCP stream: 0.542121000 seconds]
        [Time since previous frame in this TCP stream: 0.001734000 seconds]
    [SEQ/ACK analysis]
        [iRTT: 0.260260000 seconds]
        [Bytes in flight: 93]
        [Bytes sent since last PSH flag: 93]
    TCP payload (93 bytes)
Transport Layer Security
    TLSv1.2 Record Layer: Handshake Protocol: Client Key Exchange
        Content Type: Handshake (22)
        Version: TLS 1.2 (0x0303)
        Length: 37
        Handshake Protocol: Client Key Exchange
            Handshake Type: Client Key Exchange (16)
            Length: 33
            EC Diffie-Hellman Client Params
                Pubkey Length: 32
                Pubkey: 543ebb0799cd48977e1aa8f84995df472f6ec1ee2e72092ee9d48163e081ce6f
    TLSv1.2 Record Layer: Change Cipher Spec Protocol: Change Cipher Spec
        Content Type: Change Cipher Spec (20)
        Version: TLS 1.2 (0x0303)
        Length: 1
        Change Cipher Spec Message
    TLSv1.2 Record Layer: Handshake Protocol: Encrypted Handshake Message
        Content Type: Handshake (22)
        Version: TLS 1.2 (0x0303)
        Length: 40
        Handshake Protocol: Encrypted Handshake Message

No.     Time           Source                Destination           Protocol Length Info
    145 12.225547      5.252.32.98           192.168.0.6           TCP      1414   [TCP Spurious Retransmission] 443 → 63778 [ACK] Seq=1 Ack=214 Win=67072 Len=1360

Frame 145: 1414 bytes on wire (11312 bits), 1414 bytes captured (11312 bits) on interface \Device\NPF_{9DA57E6A-DB56-483D-A9F1-101740B9C29A}, id 0
    Section number: 1
    Interface id: 0 (\Device\NPF_{9DA57E6A-DB56-483D-A9F1-101740B9C29A})
        Interface name: \Device\NPF_{9DA57E6A-DB56-483D-A9F1-101740B9C29A}
        Interface description: Wi-Fi
    Encapsulation type: Ethernet (1)
    Arrival Time: Jul 10, 2024 01:01:24.208142000 Hora estándar de Argentina
    UTC Arrival Time: Jul 10, 2024 04:01:24.208142000 UTC
    Epoch Arrival Time: 1720584084.208142000
    [Time shift for this packet: 0.000000000 seconds]
    [Time delta from previous captured frame: 0.037587000 seconds]
    [Time delta from previous displayed frame: 0.207081000 seconds]
    [Time since reference or first frame: 12.225547000 seconds]
    Frame Number: 145
    Frame Length: 1414 bytes (11312 bits)
    Capture Length: 1414 bytes (11312 bits)
    [Frame is marked: False]
    [Frame is ignored: False]
    [Protocols in frame: eth:ethertype:ip:tcp]
    [Coloring Rule Name: Bad TCP]
    [Coloring Rule String: tcp.analysis.flags && !tcp.analysis.window_update && !tcp.analysis.keep_alive && !tcp.analysis.keep_alive_ack]
Ethernet II, Src: Maxlinear_80:00:00 (00:50:f1:80:00:00), Dst: AzureWaveTec_78:d7:21 (ec:2e:98:78:d7:21)
    Destination: AzureWaveTec_78:d7:21 (ec:2e:98:78:d7:21)
        Address: AzureWaveTec_78:d7:21 (ec:2e:98:78:d7:21)
        .... ..0. .... .... .... .... = LG bit: Globally unique address (factory default)
        .... ...0 .... .... .... .... = IG bit: Individual address (unicast)
    Source: Maxlinear_80:00:00 (00:50:f1:80:00:00)
        Address: Maxlinear_80:00:00 (00:50:f1:80:00:00)
        .... ..0. .... .... .... .... = LG bit: Globally unique address (factory default)
        .... ...0 .... .... .... .... = IG bit: Individual address (unicast)
    Type: IPv4 (0x0800)
Internet Protocol Version 4, Src: 5.252.32.98, Dst: 192.168.0.6
    0100 .... = Version: 4
    .... 0101 = Header Length: 20 bytes (5)
    Differentiated Services Field: 0x50 (DSCP: AF22, ECN: Not-ECT)
        0101 00.. = Differentiated Services Codepoint: Assured Forwarding 22 (20)
        .... ..00 = Explicit Congestion Notification: Not ECN-Capable Transport (0)
    Total Length: 1400
    Identification: 0x8091 (32913)
    010. .... = Flags: 0x2, Don't fragment
        0... .... = Reserved bit: Not set
        .1.. .... = Don't fragment: Set
        ..0. .... = More fragments: Not set
    ...0 0000 0000 0000 = Fragment Offset: 0
    Time to Live: 55
    Protocol: TCP (6)
    Header Checksum: 0xd692 [validation disabled]
    [Header checksum status: Unverified]
    Source Address: 5.252.32.98
    Destination Address: 192.168.0.6
Transmission Control Protocol, Src Port: 443, Dst Port: 63778, Seq: 1, Ack: 214, Len: 1360
    Source Port: 443
    Destination Port: 63778
    [Stream index: 7]
    [Conversation completeness: Complete, WITH_DATA (31)]
        ..0. .... = RST: Absent
        ...1 .... = FIN: Present
        .... 1... = Data: Present
        .... .1.. = ACK: Present
        .... ..1. = SYN-ACK: Present
        .... ...1 = SYN: Present
        [Completeness Flags: ·FDASS]
    [TCP Segment Len: 1360]
    Sequence Number: 1    (relative sequence number)
    Sequence Number (raw): 3540580838
    [Next Sequence Number: 1361    (relative sequence number)]
    Acknowledgment Number: 214    (relative ack number)
    Acknowledgment number (raw): 3240811052
    0101 .... = Header Length: 20 bytes (5)
    Flags: 0x010 (ACK)
        000. .... .... = Reserved: Not set
        ...0 .... .... = Accurate ECN: Not set
        .... 0... .... = Congestion Window Reduced: Not set
        .... .0.. .... = ECN-Echo: Not set
        .... ..0. .... = Urgent: Not set
        .... ...1 .... = Acknowledgment: Set
        .... .... 0... = Push: Not set
        .... .... .0.. = Reset: Not set
        .... .... ..0. = Syn: Not set
        .... .... ...0 = Fin: Not set
        [TCP Flags: ·······A····]
    Window: 131
    [Calculated window size: 67072]
    [Window size scaling factor: 512]
    Checksum: 0xa6e0 [unverified]
    [Checksum Status: Unverified]
    Urgent Pointer: 0
    [Timestamps]
        [Time since first frame in this TCP stream: 0.749202000 seconds]
        [Time since previous frame in this TCP stream: 0.207081000 seconds]
    [SEQ/ACK analysis]
        [iRTT: 0.260260000 seconds]
        [Bytes in flight: 1360]
        [Bytes sent since last PSH flag: 1360]
        [TCP Analysis Flags]
            [Expert Info (Note/Sequence): This frame is a (suspected) spurious retransmission]
                [This frame is a (suspected) spurious retransmission]
                [Severity level: Note]
                [Group: Sequence]
            [Expert Info (Note/Sequence): This frame is a (suspected) retransmission]
                [This frame is a (suspected) retransmission]
                [Severity level: Note]
                [Group: Sequence]
    TCP payload (1360 bytes)
    Retransmitted TCP segment data (1360 bytes)

No.     Time           Source                Destination           Protocol Length Info
    146 12.225604      192.168.0.6           5.252.32.98           TCP      66     [TCP Dup ACK 140#2] 63778 → 443 [ACK] Seq=307 Ack=2999 Win=131840 Len=0 SLE=1 SRE=1361

Frame 146: 66 bytes on wire (528 bits), 66 bytes captured (528 bits) on interface \Device\NPF_{9DA57E6A-DB56-483D-A9F1-101740B9C29A}, id 0
    Section number: 1
    Interface id: 0 (\Device\NPF_{9DA57E6A-DB56-483D-A9F1-101740B9C29A})
        Interface name: \Device\NPF_{9DA57E6A-DB56-483D-A9F1-101740B9C29A}
        Interface description: Wi-Fi
    Encapsulation type: Ethernet (1)
    Arrival Time: Jul 10, 2024 01:01:24.208199000 Hora estándar de Argentina
    UTC Arrival Time: Jul 10, 2024 04:01:24.208199000 UTC
    Epoch Arrival Time: 1720584084.208199000
    [Time shift for this packet: 0.000000000 seconds]
    [Time delta from previous captured frame: 0.000057000 seconds]
    [Time delta from previous displayed frame: 0.000057000 seconds]
    [Time since reference or first frame: 12.225604000 seconds]
    Frame Number: 146
    Frame Length: 66 bytes (528 bits)
    Capture Length: 66 bytes (528 bits)
    [Frame is marked: False]
    [Frame is ignored: False]
    [Protocols in frame: eth:ethertype:ip:tcp]
    [Coloring Rule Name: Bad TCP]
    [Coloring Rule String: tcp.analysis.flags && !tcp.analysis.window_update && !tcp.analysis.keep_alive && !tcp.analysis.keep_alive_ack]
Ethernet II, Src: AzureWaveTec_78:d7:21 (ec:2e:98:78:d7:21), Dst: Maxlinear_80:00:00 (00:50:f1:80:00:00)
    Destination: Maxlinear_80:00:00 (00:50:f1:80:00:00)
        Address: Maxlinear_80:00:00 (00:50:f1:80:00:00)
        .... ..0. .... .... .... .... = LG bit: Globally unique address (factory default)
        .... ...0 .... .... .... .... = IG bit: Individual address (unicast)
    Source: AzureWaveTec_78:d7:21 (ec:2e:98:78:d7:21)
        Address: AzureWaveTec_78:d7:21 (ec:2e:98:78:d7:21)
        .... ..0. .... .... .... .... = LG bit: Globally unique address (factory default)
        .... ...0 .... .... .... .... = IG bit: Individual address (unicast)
    Type: IPv4 (0x0800)
Internet Protocol Version 4, Src: 192.168.0.6, Dst: 5.252.32.98
    0100 .... = Version: 4
    .... 0101 = Header Length: 20 bytes (5)
    Differentiated Services Field: 0x00 (DSCP: CS0, ECN: Not-ECT)
        0000 00.. = Differentiated Services Codepoint: Default (0)
        .... ..00 = Explicit Congestion Notification: Not ECN-Capable Transport (0)
    Total Length: 52
    Identification: 0x4592 (17810)
    010. .... = Flags: 0x2, Don't fragment
        0... .... = Reserved bit: Not set
        .1.. .... = Don't fragment: Set
        ..0. .... = More fragments: Not set
    ...0 0000 0000 0000 = Fragment Offset: 0
    Time to Live: 128
    Protocol: TCP (6)
    Header Checksum: 0xce25 [validation disabled]
    [Header checksum status: Unverified]
    Source Address: 192.168.0.6
    Destination Address: 5.252.32.98
Transmission Control Protocol, Src Port: 63778, Dst Port: 443, Seq: 307, Ack: 2999, Len: 0
    Source Port: 63778
    Destination Port: 443
    [Stream index: 7]
    [Conversation completeness: Complete, WITH_DATA (31)]
        ..0. .... = RST: Absent
        ...1 .... = FIN: Present
        .... 1... = Data: Present
        .... .1.. = ACK: Present
        .... ..1. = SYN-ACK: Present
        .... ...1 = SYN: Present
        [Completeness Flags: ·FDASS]
    [TCP Segment Len: 0]
    Sequence Number: 307    (relative sequence number)
    Sequence Number (raw): 3240811145
    [Next Sequence Number: 307    (relative sequence number)]
    Acknowledgment Number: 2999    (relative ack number)
    Acknowledgment number (raw): 3540583836
    1000 .... = Header Length: 32 bytes (8)
    Flags: 0x010 (ACK)
        000. .... .... = Reserved: Not set
        ...0 .... .... = Accurate ECN: Not set
        .... 0... .... = Congestion Window Reduced: Not set
        .... .0.. .... = ECN-Echo: Not set
        .... ..0. .... = Urgent: Not set
        .... ...1 .... = Acknowledgment: Set
        .... .... 0... = Push: Not set
        .... .... .0.. = Reset: Not set
        .... .... ..0. = Syn: Not set
        .... .... ...0 = Fin: Not set
        [TCP Flags: ·······A····]
    Window: 515
    [Calculated window size: 131840]
    [Window size scaling factor: 256]
    Checksum: 0x8246 [unverified]
    [Checksum Status: Unverified]
    Urgent Pointer: 0
    Options: (12 bytes), No-Operation (NOP), No-Operation (NOP), SACK
        TCP Option - No-Operation (NOP)
            Kind: No-Operation (1)
        TCP Option - No-Operation (NOP)
            Kind: No-Operation (1)
        TCP Option - SACK 1-1361
            Kind: SACK (5)
            Length: 10
            left edge = 1 (relative)
            right edge = 1361 (relative)
            [TCP SACK Count: 1]
            [D-SACK Left Edge = 1 (relative)]
            [D-SACK Right Edge = 1361 (relative)]
            D-SACK Sequence
                [Expert Info (Warning/Sequence): D-SACK Sequence]
                    [D-SACK Sequence]
                    [Severity level: Warning]
                    [Group: Sequence]
    [Timestamps]
        [Time since first frame in this TCP stream: 0.749259000 seconds]
        [Time since previous frame in this TCP stream: 0.000057000 seconds]
    [SEQ/ACK analysis]
        [iRTT: 0.260260000 seconds]
        [TCP Analysis Flags]
            [This is a TCP duplicate ack]
        [Duplicate ACK #: 2]
        [Duplicate to the ACK in frame: 140]
            [Expert Info (Note/Sequence): Duplicate ACK (#2)]
                [Duplicate ACK (#2)]
                [Severity level: Note]
                [Group: Sequence]

No.     Time           Source                Destination           Protocol Length Info
    147 12.277014      5.252.32.98           192.168.0.6           TLSv1.2  105    Change Cipher Spec, Encrypted Handshake Message

Frame 147: 105 bytes on wire (840 bits), 105 bytes captured (840 bits) on interface \Device\NPF_{9DA57E6A-DB56-483D-A9F1-101740B9C29A}, id 0
    Section number: 1
    Interface id: 0 (\Device\NPF_{9DA57E6A-DB56-483D-A9F1-101740B9C29A})
        Interface name: \Device\NPF_{9DA57E6A-DB56-483D-A9F1-101740B9C29A}
        Interface description: Wi-Fi
    Encapsulation type: Ethernet (1)
    Arrival Time: Jul 10, 2024 01:01:24.259609000 Hora estándar de Argentina
    UTC Arrival Time: Jul 10, 2024 04:01:24.259609000 UTC
    Epoch Arrival Time: 1720584084.259609000
    [Time shift for this packet: 0.000000000 seconds]
    [Time delta from previous captured frame: 0.051410000 seconds]
    [Time delta from previous displayed frame: 0.051410000 seconds]
    [Time since reference or first frame: 12.277014000 seconds]
    Frame Number: 147
    Frame Length: 105 bytes (840 bits)
    Capture Length: 105 bytes (840 bits)
    [Frame is marked: False]
    [Frame is ignored: False]
    [Protocols in frame: eth:ethertype:ip:tcp:tls]
    [Coloring Rule Name: TCP]
    [Coloring Rule String: tcp]
Ethernet II, Src: Maxlinear_80:00:00 (00:50:f1:80:00:00), Dst: AzureWaveTec_78:d7:21 (ec:2e:98:78:d7:21)
    Destination: AzureWaveTec_78:d7:21 (ec:2e:98:78:d7:21)
        Address: AzureWaveTec_78:d7:21 (ec:2e:98:78:d7:21)
        .... ..0. .... .... .... .... = LG bit: Globally unique address (factory default)
        .... ...0 .... .... .... .... = IG bit: Individual address (unicast)
    Source: Maxlinear_80:00:00 (00:50:f1:80:00:00)
        Address: Maxlinear_80:00:00 (00:50:f1:80:00:00)
        .... ..0. .... .... .... .... = LG bit: Globally unique address (factory default)
        .... ...0 .... .... .... .... = IG bit: Individual address (unicast)
    Type: IPv4 (0x0800)
Internet Protocol Version 4, Src: 5.252.32.98, Dst: 192.168.0.6
    0100 .... = Version: 4
    .... 0101 = Header Length: 20 bytes (5)
    Differentiated Services Field: 0x50 (DSCP: AF22, ECN: Not-ECT)
        0101 00.. = Differentiated Services Codepoint: Assured Forwarding 22 (20)
        .... ..00 = Explicit Congestion Notification: Not ECN-Capable Transport (0)
    Total Length: 91
    Identification: 0x8092 (32914)
    010. .... = Flags: 0x2, Don't fragment
        0... .... = Reserved bit: Not set
        .1.. .... = Don't fragment: Set
        ..0. .... = More fragments: Not set
    ...0 0000 0000 0000 = Fragment Offset: 0
    Time to Live: 55
    Protocol: TCP (6)
    Header Checksum: 0xdbae [validation disabled]
    [Header checksum status: Unverified]
    Source Address: 5.252.32.98
    Destination Address: 192.168.0.6
Transmission Control Protocol, Src Port: 443, Dst Port: 63778, Seq: 2999, Ack: 307, Len: 51
    Source Port: 443
    Destination Port: 63778
    [Stream index: 7]
    [Conversation completeness: Complete, WITH_DATA (31)]
        ..0. .... = RST: Absent
        ...1 .... = FIN: Present
        .... 1... = Data: Present
        .... .1.. = ACK: Present
        .... ..1. = SYN-ACK: Present
        .... ...1 = SYN: Present
        [Completeness Flags: ·FDASS]
    [TCP Segment Len: 51]
    Sequence Number: 2999    (relative sequence number)
    Sequence Number (raw): 3540583836
    [Next Sequence Number: 3050    (relative sequence number)]
    Acknowledgment Number: 307    (relative ack number)
    Acknowledgment number (raw): 3240811145
    0101 .... = Header Length: 20 bytes (5)
    Flags: 0x018 (PSH, ACK)
        000. .... .... = Reserved: Not set
        ...0 .... .... = Accurate ECN: Not set
        .... 0... .... = Congestion Window Reduced: Not set
        .... .0.. .... = ECN-Echo: Not set
        .... ..0. .... = Urgent: Not set
        .... ...1 .... = Acknowledgment: Set
        .... .... 1... = Push: Set
        .... .... .0.. = Reset: Not set
        .... .... ..0. = Syn: Not set
        .... .... ...0 = Fin: Not set
        [TCP Flags: ·······AP···]
    Window: 131
    [Calculated window size: 67072]
    [Window size scaling factor: 512]
    Checksum: 0x9add [unverified]
    [Checksum Status: Unverified]
    Urgent Pointer: 0
    [Timestamps]
        [Time since first frame in this TCP stream: 0.800669000 seconds]
        [Time since previous frame in this TCP stream: 0.051410000 seconds]
    [SEQ/ACK analysis]
        [This is an ACK to the segment in frame: 143]
        [The RTT to ACK the segment was: 0.258548000 seconds]
        [iRTT: 0.260260000 seconds]
    TCP payload (51 bytes)
Transport Layer Security
    TLSv1.2 Record Layer: Change Cipher Spec Protocol: Change Cipher Spec
        Content Type: Change Cipher Spec (20)
        Version: TLS 1.2 (0x0303)
        Length: 1
        Change Cipher Spec Message
    TLSv1.2 Record Layer: Handshake Protocol: Encrypted Handshake Message
        Content Type: Handshake (22)
        Version: TLS 1.2 (0x0303)
        Length: 40
        Handshake Protocol: Encrypted Handshake Message

No.     Time           Source                Destination           Protocol Length Info
    148 12.278377      192.168.0.6           5.252.32.98           TCP      1414   63778 → 443 [ACK] Seq=307 Ack=3050 Win=131840 Len=1360 [TCP segment of a reassembled PDU]

Frame 148: 1414 bytes on wire (11312 bits), 1414 bytes captured (11312 bits) on interface \Device\NPF_{9DA57E6A-DB56-483D-A9F1-101740B9C29A}, id 0
    Section number: 1
    Interface id: 0 (\Device\NPF_{9DA57E6A-DB56-483D-A9F1-101740B9C29A})
        Interface name: \Device\NPF_{9DA57E6A-DB56-483D-A9F1-101740B9C29A}
        Interface description: Wi-Fi
    Encapsulation type: Ethernet (1)
    Arrival Time: Jul 10, 2024 01:01:24.260972000 Hora estándar de Argentina
    UTC Arrival Time: Jul 10, 2024 04:01:24.260972000 UTC
    Epoch Arrival Time: 1720584084.260972000
    [Time shift for this packet: 0.000000000 seconds]
    [Time delta from previous captured frame: 0.001363000 seconds]
    [Time delta from previous displayed frame: 0.001363000 seconds]
    [Time since reference or first frame: 12.278377000 seconds]
    Frame Number: 148
    Frame Length: 1414 bytes (11312 bits)
    Capture Length: 1414 bytes (11312 bits)
    [Frame is marked: False]
    [Frame is ignored: False]
    [Protocols in frame: eth:ethertype:ip:tcp]
    [Coloring Rule Name: TCP]
    [Coloring Rule String: tcp]
Ethernet II, Src: AzureWaveTec_78:d7:21 (ec:2e:98:78:d7:21), Dst: Maxlinear_80:00:00 (00:50:f1:80:00:00)
    Destination: Maxlinear_80:00:00 (00:50:f1:80:00:00)
        Address: Maxlinear_80:00:00 (00:50:f1:80:00:00)
        .... ..0. .... .... .... .... = LG bit: Globally unique address (factory default)
        .... ...0 .... .... .... .... = IG bit: Individual address (unicast)
    Source: AzureWaveTec_78:d7:21 (ec:2e:98:78:d7:21)
        Address: AzureWaveTec_78:d7:21 (ec:2e:98:78:d7:21)
        .... ..0. .... .... .... .... = LG bit: Globally unique address (factory default)
        .... ...0 .... .... .... .... = IG bit: Individual address (unicast)
    Type: IPv4 (0x0800)
Internet Protocol Version 4, Src: 192.168.0.6, Dst: 5.252.32.98
    0100 .... = Version: 4
    .... 0101 = Header Length: 20 bytes (5)
    Differentiated Services Field: 0x00 (DSCP: CS0, ECN: Not-ECT)
        0000 00.. = Differentiated Services Codepoint: Default (0)
        .... ..00 = Explicit Congestion Notification: Not ECN-Capable Transport (0)
    Total Length: 1400
    Identification: 0x4593 (17811)
    010. .... = Flags: 0x2, Don't fragment
        0... .... = Reserved bit: Not set
        .1.. .... = Don't fragment: Set
        ..0. .... = More fragments: Not set
    ...0 0000 0000 0000 = Fragment Offset: 0
    Time to Live: 128
    Protocol: TCP (6)
    Header Checksum: 0xc8e0 [validation disabled]
    [Header checksum status: Unverified]
    Source Address: 192.168.0.6
    Destination Address: 5.252.32.98
Transmission Control Protocol, Src Port: 63778, Dst Port: 443, Seq: 307, Ack: 3050, Len: 1360
    Source Port: 63778
    Destination Port: 443
    [Stream index: 7]
    [Conversation completeness: Complete, WITH_DATA (31)]
        ..0. .... = RST: Absent
        ...1 .... = FIN: Present
        .... 1... = Data: Present
        .... .1.. = ACK: Present
        .... ..1. = SYN-ACK: Present
        .... ...1 = SYN: Present
        [Completeness Flags: ·FDASS]
    [TCP Segment Len: 1360]
    Sequence Number: 307    (relative sequence number)
    Sequence Number (raw): 3240811145
    [Next Sequence Number: 1667    (relative sequence number)]
    Acknowledgment Number: 3050    (relative ack number)
    Acknowledgment number (raw): 3540583887
    0101 .... = Header Length: 20 bytes (5)
    Flags: 0x010 (ACK)
        000. .... .... = Reserved: Not set
        ...0 .... .... = Accurate ECN: Not set
        .... 0... .... = Congestion Window Reduced: Not set
        .... .0.. .... = ECN-Echo: Not set
        .... ..0. .... = Urgent: Not set
        .... ...1 .... = Acknowledgment: Set
        .... .... 0... = Push: Not set
        .... .... .0.. = Reset: Not set
        .... .... ..0. = Syn: Not set
        .... .... ...0 = Fin: Not set
        [TCP Flags: ·······A····]
    Window: 515
    [Calculated window size: 131840]
    [Window size scaling factor: 256]
    Checksum: 0x4606 [unverified]
    [Checksum Status: Unverified]
    Urgent Pointer: 0
    [Timestamps]
        [Time since first frame in this TCP stream: 0.802032000 seconds]
        [Time since previous frame in this TCP stream: 0.001363000 seconds]
    [SEQ/ACK analysis]
        [This is an ACK to the segment in frame: 147]
        [The RTT to ACK the segment was: 0.001363000 seconds]
        [iRTT: 0.260260000 seconds]
        [Bytes in flight: 1360]
        [Bytes sent since last PSH flag: 1360]
    TCP payload (1360 bytes)
    [Reassembled PDU in frame: 151]
    TCP segment data (1360 bytes)

No.     Time           Source                Destination           Protocol Length Info
    149 12.278377      192.168.0.6           5.252.32.98           TCP      1414   63778 → 443 [ACK] Seq=1667 Ack=3050 Win=131840 Len=1360 [TCP segment of a reassembled PDU]

Frame 149: 1414 bytes on wire (11312 bits), 1414 bytes captured (11312 bits) on interface \Device\NPF_{9DA57E6A-DB56-483D-A9F1-101740B9C29A}, id 0
    Section number: 1
    Interface id: 0 (\Device\NPF_{9DA57E6A-DB56-483D-A9F1-101740B9C29A})
        Interface name: \Device\NPF_{9DA57E6A-DB56-483D-A9F1-101740B9C29A}
        Interface description: Wi-Fi
    Encapsulation type: Ethernet (1)
    Arrival Time: Jul 10, 2024 01:01:24.260972000 Hora estándar de Argentina
    UTC Arrival Time: Jul 10, 2024 04:01:24.260972000 UTC
    Epoch Arrival Time: 1720584084.260972000
    [Time shift for this packet: 0.000000000 seconds]
    [Time delta from previous captured frame: 0.000000000 seconds]
    [Time delta from previous displayed frame: 0.000000000 seconds]
    [Time since reference or first frame: 12.278377000 seconds]
    Frame Number: 149
    Frame Length: 1414 bytes (11312 bits)
    Capture Length: 1414 bytes (11312 bits)
    [Frame is marked: False]
    [Frame is ignored: False]
    [Protocols in frame: eth:ethertype:ip:tcp]
    [Coloring Rule Name: TCP]
    [Coloring Rule String: tcp]
Ethernet II, Src: AzureWaveTec_78:d7:21 (ec:2e:98:78:d7:21), Dst: Maxlinear_80:00:00 (00:50:f1:80:00:00)
    Destination: Maxlinear_80:00:00 (00:50:f1:80:00:00)
        Address: Maxlinear_80:00:00 (00:50:f1:80:00:00)
        .... ..0. .... .... .... .... = LG bit: Globally unique address (factory default)
        .... ...0 .... .... .... .... = IG bit: Individual address (unicast)
    Source: AzureWaveTec_78:d7:21 (ec:2e:98:78:d7:21)
        Address: AzureWaveTec_78:d7:21 (ec:2e:98:78:d7:21)
        .... ..0. .... .... .... .... = LG bit: Globally unique address (factory default)
        .... ...0 .... .... .... .... = IG bit: Individual address (unicast)
    Type: IPv4 (0x0800)
Internet Protocol Version 4, Src: 192.168.0.6, Dst: 5.252.32.98
    0100 .... = Version: 4
    .... 0101 = Header Length: 20 bytes (5)
    Differentiated Services Field: 0x00 (DSCP: CS0, ECN: Not-ECT)
        0000 00.. = Differentiated Services Codepoint: Default (0)
        .... ..00 = Explicit Congestion Notification: Not ECN-Capable Transport (0)
    Total Length: 1400
    Identification: 0x4594 (17812)
    010. .... = Flags: 0x2, Don't fragment
        0... .... = Reserved bit: Not set
        .1.. .... = Don't fragment: Set
        ..0. .... = More fragments: Not set
    ...0 0000 0000 0000 = Fragment Offset: 0
    Time to Live: 128
    Protocol: TCP (6)
    Header Checksum: 0xc8df [validation disabled]
    [Header checksum status: Unverified]
    Source Address: 192.168.0.6
    Destination Address: 5.252.32.98
Transmission Control Protocol, Src Port: 63778, Dst Port: 443, Seq: 1667, Ack: 3050, Len: 1360
    Source Port: 63778
    Destination Port: 443
    [Stream index: 7]
    [Conversation completeness: Complete, WITH_DATA (31)]
        ..0. .... = RST: Absent
        ...1 .... = FIN: Present
        .... 1... = Data: Present
        .... .1.. = ACK: Present
        .... ..1. = SYN-ACK: Present
        .... ...1 = SYN: Present
        [Completeness Flags: ·FDASS]
    [TCP Segment Len: 1360]
    Sequence Number: 1667    (relative sequence number)
    Sequence Number (raw): 3240812505
    [Next Sequence Number: 3027    (relative sequence number)]
    Acknowledgment Number: 3050    (relative ack number)
    Acknowledgment number (raw): 3540583887
    0101 .... = Header Length: 20 bytes (5)
    Flags: 0x010 (ACK)
        000. .... .... = Reserved: Not set
        ...0 .... .... = Accurate ECN: Not set
        .... 0... .... = Congestion Window Reduced: Not set
        .... .0.. .... = ECN-Echo: Not set
        .... ..0. .... = Urgent: Not set
        .... ...1 .... = Acknowledgment: Set
        .... .... 0... = Push: Not set
        .... .... .0.. = Reset: Not set
        .... .... ..0. = Syn: Not set
        .... .... ...0 = Fin: Not set
        [TCP Flags: ·······A····]
    Window: 515
    [Calculated window size: 131840]
    [Window size scaling factor: 256]
    Checksum: 0xfdca [unverified]
    [Checksum Status: Unverified]
    Urgent Pointer: 0
    [Timestamps]
        [Time since first frame in this TCP stream: 0.802032000 seconds]
        [Time since previous frame in this TCP stream: 0.000000000 seconds]
    [SEQ/ACK analysis]
        [iRTT: 0.260260000 seconds]
        [Bytes in flight: 2720]
        [Bytes sent since last PSH flag: 2720]
    TCP payload (1360 bytes)
    [Reassembled PDU in frame: 151]
    TCP segment data (1360 bytes)

No.     Time           Source                Destination           Protocol Length Info
    150 12.278377      192.168.0.6           5.252.32.98           TCP      1414   63778 → 443 [ACK] Seq=3027 Ack=3050 Win=131840 Len=1360 [TCP segment of a reassembled PDU]

Frame 150: 1414 bytes on wire (11312 bits), 1414 bytes captured (11312 bits) on interface \Device\NPF_{9DA57E6A-DB56-483D-A9F1-101740B9C29A}, id 0
    Section number: 1
    Interface id: 0 (\Device\NPF_{9DA57E6A-DB56-483D-A9F1-101740B9C29A})
        Interface name: \Device\NPF_{9DA57E6A-DB56-483D-A9F1-101740B9C29A}
        Interface description: Wi-Fi
    Encapsulation type: Ethernet (1)
    Arrival Time: Jul 10, 2024 01:01:24.260972000 Hora estándar de Argentina
    UTC Arrival Time: Jul 10, 2024 04:01:24.260972000 UTC
    Epoch Arrival Time: 1720584084.260972000
    [Time shift for this packet: 0.000000000 seconds]
    [Time delta from previous captured frame: 0.000000000 seconds]
    [Time delta from previous displayed frame: 0.000000000 seconds]
    [Time since reference or first frame: 12.278377000 seconds]
    Frame Number: 150
    Frame Length: 1414 bytes (11312 bits)
    Capture Length: 1414 bytes (11312 bits)
    [Frame is marked: False]
    [Frame is ignored: False]
    [Protocols in frame: eth:ethertype:ip:tcp]
    [Coloring Rule Name: TCP]
    [Coloring Rule String: tcp]
Ethernet II, Src: AzureWaveTec_78:d7:21 (ec:2e:98:78:d7:21), Dst: Maxlinear_80:00:00 (00:50:f1:80:00:00)
    Destination: Maxlinear_80:00:00 (00:50:f1:80:00:00)
        Address: Maxlinear_80:00:00 (00:50:f1:80:00:00)
        .... ..0. .... .... .... .... = LG bit: Globally unique address (factory default)
        .... ...0 .... .... .... .... = IG bit: Individual address (unicast)
    Source: AzureWaveTec_78:d7:21 (ec:2e:98:78:d7:21)
        Address: AzureWaveTec_78:d7:21 (ec:2e:98:78:d7:21)
        .... ..0. .... .... .... .... = LG bit: Globally unique address (factory default)
        .... ...0 .... .... .... .... = IG bit: Individual address (unicast)
    Type: IPv4 (0x0800)
Internet Protocol Version 4, Src: 192.168.0.6, Dst: 5.252.32.98
    0100 .... = Version: 4
    .... 0101 = Header Length: 20 bytes (5)
    Differentiated Services Field: 0x00 (DSCP: CS0, ECN: Not-ECT)
        0000 00.. = Differentiated Services Codepoint: Default (0)
        .... ..00 = Explicit Congestion Notification: Not ECN-Capable Transport (0)
    Total Length: 1400
    Identification: 0x4595 (17813)
    010. .... = Flags: 0x2, Don't fragment
        0... .... = Reserved bit: Not set
        .1.. .... = Don't fragment: Set
        ..0. .... = More fragments: Not set
    ...0 0000 0000 0000 = Fragment Offset: 0
    Time to Live: 128
    Protocol: TCP (6)
    Header Checksum: 0xc8de [validation disabled]
    [Header checksum status: Unverified]
    Source Address: 192.168.0.6
    Destination Address: 5.252.32.98
Transmission Control Protocol, Src Port: 63778, Dst Port: 443, Seq: 3027, Ack: 3050, Len: 1360
    Source Port: 63778
    Destination Port: 443
    [Stream index: 7]
    [Conversation completeness: Complete, WITH_DATA (31)]
        ..0. .... = RST: Absent
        ...1 .... = FIN: Present
        .... 1... = Data: Present
        .... .1.. = ACK: Present
        .... ..1. = SYN-ACK: Present
        .... ...1 = SYN: Present
        [Completeness Flags: ·FDASS]
    [TCP Segment Len: 1360]
    Sequence Number: 3027    (relative sequence number)
    Sequence Number (raw): 3240813865
    [Next Sequence Number: 4387    (relative sequence number)]
    Acknowledgment Number: 3050    (relative ack number)
    Acknowledgment number (raw): 3540583887
    0101 .... = Header Length: 20 bytes (5)
    Flags: 0x010 (ACK)
        000. .... .... = Reserved: Not set
        ...0 .... .... = Accurate ECN: Not set
        .... 0... .... = Congestion Window Reduced: Not set
        .... .0.. .... = ECN-Echo: Not set
        .... ..0. .... = Urgent: Not set
        .... ...1 .... = Acknowledgment: Set
        .... .... 0... = Push: Not set
        .... .... .0.. = Reset: Not set
        .... .... ..0. = Syn: Not set
        .... .... ...0 = Fin: Not set
        [TCP Flags: ·······A····]
    Window: 515
    [Calculated window size: 131840]
    [Window size scaling factor: 256]
    Checksum: 0xdff5 [unverified]
    [Checksum Status: Unverified]
    Urgent Pointer: 0
    [Timestamps]
        [Time since first frame in this TCP stream: 0.802032000 seconds]
        [Time since previous frame in this TCP stream: 0.000000000 seconds]
    [SEQ/ACK analysis]
        [iRTT: 0.260260000 seconds]
        [Bytes in flight: 4080]
        [Bytes sent since last PSH flag: 4080]
    TCP payload (1360 bytes)
    [Reassembled PDU in frame: 151]
    TCP segment data (1360 bytes)
z
