
No.     Time           Source                Destination           Protocol Length Info
    151 12.278377      192.168.0.6           5.252.32.98           TLSv1.2  99     Application Data

Frame 151: 99 bytes on wire (792 bits), 99 bytes captured (792 bits) on interface \Device\NPF_{9DA57E6A-DB56-483D-A9F1-101740B9C29A}, id 0
    Section number: 1
    Interface id: 0 (\Device\NPF_{9DA57E6A-DB56-483D-A9F1-101740B9C29A})
        Interface name: \Device\NPF_{9DA57E6A-DB56-483D-A9F1-101740B9C29A}
        Interface description: Wi-Fi
    Encapsulation type: Ethernet (1)
    Arrival Time: Jul 10, 2024 01:01:24.260972000 Hora estándar de Argentina
    UTC Arrival Time: Jul 10, 2024 04:01:24.260972000 UTC
    Epoch Arrival Time: 1720584084.260972000
    [Time shift for this packet: 0.000000000 seconds]
    [Time delta from previous captured frame: 0.000000000 seconds]
    [Time delta from previous displayed frame: 0.000000000 seconds]
    [Time since reference or first frame: 12.278377000 seconds]
    Frame Number: 151
    Frame Length: 99 bytes (792 bits)
    Capture Length: 99 bytes (792 bits)
    [Frame is marked: False]
    [Frame is ignored: False]
    [Protocols in frame: eth:ethertype:ip:tcp:tls]
    [Coloring Rule Name: TCP]
    [Coloring Rule String: tcp]
Ethernet II, Src: AzureWaveTec_78:d7:21 (ec:2e:98:78:d7:21), Dst: Maxlinear_80:00:00 (00:50:f1:80:00:00)
    Destination: Maxlinear_80:00:00 (00:50:f1:80:00:00)
        Address: Maxlinear_80:00:00 (00:50:f1:80:00:00)
        .... ..0. .... .... .... .... = LG bit: Globally unique address (factory default)
        .... ...0 .... .... .... .... = IG bit: Individual address (unicast)
    Source: AzureWaveTec_78:d7:21 (ec:2e:98:78:d7:21)
        Address: AzureWaveTec_78:d7:21 (ec:2e:98:78:d7:21)
        .... ..0. .... .... .... .... = LG bit: Globally unique address (factory default)
        .... ...0 .... .... .... .... = IG bit: Individual address (unicast)
    Type: IPv4 (0x0800)
Internet Protocol Version 4, Src: 192.168.0.6, Dst: 5.252.32.98
    0100 .... = Version: 4
    .... 0101 = Header Length: 20 bytes (5)
    Differentiated Services Field: 0x00 (DSCP: CS0, ECN: Not-ECT)
        0000 00.. = Differentiated Services Codepoint: Default (0)
        .... ..00 = Explicit Congestion Notification: Not ECN-Capable Transport (0)
    Total Length: 85
    Identification: 0x4596 (17814)
    010. .... = Flags: 0x2, Don't fragment
        0... .... = Reserved bit: Not set
        .1.. .... = Don't fragment: Set
        ..0. .... = More fragments: Not set
    ...0 0000 0000 0000 = Fragment Offset: 0
    Time to Live: 128
    Protocol: TCP (6)
    Header Checksum: 0xce00 [validation disabled]
    [Header checksum status: Unverified]
    Source Address: 192.168.0.6
    Destination Address: 5.252.32.98
Transmission Control Protocol, Src Port: 63778, Dst Port: 443, Seq: 4387, Ack: 3050, Len: 45
    Source Port: 63778
    Destination Port: 443
    [Stream index: 7]
    [Conversation completeness: Complete, WITH_DATA (31)]
        ..0. .... = RST: Absent
        ...1 .... = FIN: Present
        .... 1... = Data: Present
        .... .1.. = ACK: Present
        .... ..1. = SYN-ACK: Present
        .... ...1 = SYN: Present
        [Completeness Flags: ·FDASS]
    [TCP Segment Len: 45]
    Sequence Number: 4387    (relative sequence number)
    Sequence Number (raw): 3240815225
    [Next Sequence Number: 4432    (relative sequence number)]
    Acknowledgment Number: 3050    (relative ack number)
    Acknowledgment number (raw): 3540583887
    0101 .... = Header Length: 20 bytes (5)
    Flags: 0x018 (PSH, ACK)
        000. .... .... = Reserved: Not set
        ...0 .... .... = Accurate ECN: Not set
        .... 0... .... = Congestion Window Reduced: Not set
        .... .0.. .... = ECN-Echo: Not set
        .... ..0. .... = Urgent: Not set
        .... ...1 .... = Acknowledgment: Set
        .... .... 1... = Push: Set
        .... .... .0.. = Reset: Not set
        .... .... ..0. = Syn: Not set
        .... .... ...0 = Fin: Not set
        [TCP Flags: ·······AP···]
    Window: 515
    [Calculated window size: 131840]
    [Window size scaling factor: 256]
    Checksum: 0xe6bc [unverified]
    [Checksum Status: Unverified]
    Urgent Pointer: 0
    [Timestamps]
        [Time since first frame in this TCP stream: 0.802032000 seconds]
        [Time since previous frame in this TCP stream: 0.000000000 seconds]
    [SEQ/ACK analysis]
        [iRTT: 0.260260000 seconds]
        [Bytes in flight: 4125]
        [Bytes sent since last PSH flag: 4125]
    TCP payload (45 bytes)
    TCP segment data (45 bytes)
[4 Reassembled TCP Segments (4125 bytes): #148(1360), #149(1360), #150(1360), #151(45)]
    [Frame: 148, payload: 0-1359 (1360 bytes)]
    [Frame: 149, payload: 1360-2719 (1360 bytes)]
    [Frame: 150, payload: 2720-4079 (1360 bytes)]
    [Frame: 151, payload: 4080-4124 (45 bytes)]
    [Segment count: 4]
    [Reassembled TCP length: 4125]
    [Reassembled TCP Data [truncated]: 17030310180000000000000001845c8e31233eb18b910821348fec2ae9a75addc48a798dc689b935475f4d005f2c4ece1f76172dc939397780674107fa181b4ddb254062a27d2eff184316e9d9e928630b7b8f96b403b2a5fa348a9d0e8e8a967d6aef6c8e0f5]
Transport Layer Security
    TLSv1.2 Record Layer: Application Data Protocol: Hypertext Transfer Protocol
        Content Type: Application Data (23)
        Version: TLS 1.2 (0x0303)
        Length: 4120
        Encrypted Application Data [truncated]: 0000000000000001845c8e31233eb18b910821348fec2ae9a75addc48a798dc689b935475f4d005f2c4ece1f76172dc939397780674107fa181b4ddb254062a27d2eff184316e9d9e928630b7b8f96b403b2a5fa348a9d0e8e8a967d6aef6c8e0f59a7b
        [Application Data Protocol: Hypertext Transfer Protocol]

No.     Time           Source                Destination           Protocol Length Info
    152 12.278594      192.168.0.6           5.252.32.98           TCP      1414   63778 → 443 [ACK] Seq=4432 Ack=3050 Win=131840 Len=1360 [TCP segment of a reassembled PDU]

Frame 152: 1414 bytes on wire (11312 bits), 1414 bytes captured (11312 bits) on interface \Device\NPF_{9DA57E6A-DB56-483D-A9F1-101740B9C29A}, id 0
    Section number: 1
    Interface id: 0 (\Device\NPF_{9DA57E6A-DB56-483D-A9F1-101740B9C29A})
        Interface name: \Device\NPF_{9DA57E6A-DB56-483D-A9F1-101740B9C29A}
        Interface description: Wi-Fi
    Encapsulation type: Ethernet (1)
    Arrival Time: Jul 10, 2024 01:01:24.261189000 Hora estándar de Argentina
    UTC Arrival Time: Jul 10, 2024 04:01:24.261189000 UTC
    Epoch Arrival Time: 1720584084.261189000
    [Time shift for this packet: 0.000000000 seconds]
    [Time delta from previous captured frame: 0.000217000 seconds]
    [Time delta from previous displayed frame: 0.000217000 seconds]
    [Time since reference or first frame: 12.278594000 seconds]
    Frame Number: 152
    Frame Length: 1414 bytes (11312 bits)
    Capture Length: 1414 bytes (11312 bits)
    [Frame is marked: False]
    [Frame is ignored: False]
    [Protocols in frame: eth:ethertype:ip:tcp]
    [Coloring Rule Name: TCP]
    [Coloring Rule String: tcp]
Ethernet II, Src: AzureWaveTec_78:d7:21 (ec:2e:98:78:d7:21), Dst: Maxlinear_80:00:00 (00:50:f1:80:00:00)
    Destination: Maxlinear_80:00:00 (00:50:f1:80:00:00)
        Address: Maxlinear_80:00:00 (00:50:f1:80:00:00)
        .... ..0. .... .... .... .... = LG bit: Globally unique address (factory default)
        .... ...0 .... .... .... .... = IG bit: Individual address (unicast)
    Source: AzureWaveTec_78:d7:21 (ec:2e:98:78:d7:21)
        Address: AzureWaveTec_78:d7:21 (ec:2e:98:78:d7:21)
        .... ..0. .... .... .... .... = LG bit: Globally unique address (factory default)
        .... ...0 .... .... .... .... = IG bit: Individual address (unicast)
    Type: IPv4 (0x0800)
Internet Protocol Version 4, Src: 192.168.0.6, Dst: 5.252.32.98
    0100 .... = Version: 4
    .... 0101 = Header Length: 20 bytes (5)
    Differentiated Services Field: 0x00 (DSCP: CS0, ECN: Not-ECT)
        0000 00.. = Differentiated Services Codepoint: Default (0)
        .... ..00 = Explicit Congestion Notification: Not ECN-Capable Transport (0)
    Total Length: 1400
    Identification: 0x4597 (17815)
    010. .... = Flags: 0x2, Don't fragment
        0... .... = Reserved bit: Not set
        .1.. .... = Don't fragment: Set
        ..0. .... = More fragments: Not set
    ...0 0000 0000 0000 = Fragment Offset: 0
    Time to Live: 128
    Protocol: TCP (6)
    Header Checksum: 0xc8dc [validation disabled]
    [Header checksum status: Unverified]
    Source Address: 192.168.0.6
    Destination Address: 5.252.32.98
Transmission Control Protocol, Src Port: 63778, Dst Port: 443, Seq: 4432, Ack: 3050, Len: 1360
    Source Port: 63778
    Destination Port: 443
    [Stream index: 7]
    [Conversation completeness: Complete, WITH_DATA (31)]
        ..0. .... = RST: Absent
        ...1 .... = FIN: Present
        .... 1... = Data: Present
        .... .1.. = ACK: Present
        .... ..1. = SYN-ACK: Present
        .... ...1 = SYN: Present
        [Completeness Flags: ·FDASS]
    [TCP Segment Len: 1360]
    Sequence Number: 4432    (relative sequence number)
    Sequence Number (raw): 3240815270
    [Next Sequence Number: 5792    (relative sequence number)]
    Acknowledgment Number: 3050    (relative ack number)
    Acknowledgment number (raw): 3540583887
    0101 .... = Header Length: 20 bytes (5)
    Flags: 0x010 (ACK)
        000. .... .... = Reserved: Not set
        ...0 .... .... = Accurate ECN: Not set
        .... 0... .... = Congestion Window Reduced: Not set
        .... .0.. .... = ECN-Echo: Not set
        .... ..0. .... = Urgent: Not set
        .... ...1 .... = Acknowledgment: Set
        .... .... 0... = Push: Not set
        .... .... .0.. = Reset: Not set
        .... .... ..0. = Syn: Not set
        .... .... ...0 = Fin: Not set
        [TCP Flags: ·······A····]
    Window: 515
    [Calculated window size: 131840]
    [Window size scaling factor: 256]
    Checksum: 0x61a2 [unverified]
    [Checksum Status: Unverified]
    Urgent Pointer: 0
    [Timestamps]
        [Time since first frame in this TCP stream: 0.802249000 seconds]
        [Time since previous frame in this TCP stream: 0.000217000 seconds]
    [SEQ/ACK analysis]
        [iRTT: 0.260260000 seconds]
        [Bytes in flight: 5485]
        [Bytes sent since last PSH flag: 1360]
    TCP payload (1360 bytes)
    [Reassembled PDU in frame: 170]
    TCP segment data (1360 bytes)

No.     Time           Source                Destination           Protocol Length Info
    153 12.278594      192.168.0.6           5.252.32.98           TCP      1414   63778 → 443 [ACK] Seq=5792 Ack=3050 Win=131840 Len=1360 [TCP segment of a reassembled PDU]

Frame 153: 1414 bytes on wire (11312 bits), 1414 bytes captured (11312 bits) on interface \Device\NPF_{9DA57E6A-DB56-483D-A9F1-101740B9C29A}, id 0
    Section number: 1
    Interface id: 0 (\Device\NPF_{9DA57E6A-DB56-483D-A9F1-101740B9C29A})
        Interface name: \Device\NPF_{9DA57E6A-DB56-483D-A9F1-101740B9C29A}
        Interface description: Wi-Fi
    Encapsulation type: Ethernet (1)
    Arrival Time: Jul 10, 2024 01:01:24.261189000 Hora estándar de Argentina
    UTC Arrival Time: Jul 10, 2024 04:01:24.261189000 UTC
    Epoch Arrival Time: 1720584084.261189000
    [Time shift for this packet: 0.000000000 seconds]
    [Time delta from previous captured frame: 0.000000000 seconds]
    [Time delta from previous displayed frame: 0.000000000 seconds]
    [Time since reference or first frame: 12.278594000 seconds]
    Frame Number: 153
    Frame Length: 1414 bytes (11312 bits)
    Capture Length: 1414 bytes (11312 bits)
    [Frame is marked: False]
    [Frame is ignored: False]
    [Protocols in frame: eth:ethertype:ip:tcp]
    [Coloring Rule Name: TCP]
    [Coloring Rule String: tcp]
Ethernet II, Src: AzureWaveTec_78:d7:21 (ec:2e:98:78:d7:21), Dst: Maxlinear_80:00:00 (00:50:f1:80:00:00)
    Destination: Maxlinear_80:00:00 (00:50:f1:80:00:00)
        Address: Maxlinear_80:00:00 (00:50:f1:80:00:00)
        .... ..0. .... .... .... .... = LG bit: Globally unique address (factory default)
        .... ...0 .... .... .... .... = IG bit: Individual address (unicast)
    Source: AzureWaveTec_78:d7:21 (ec:2e:98:78:d7:21)
        Address: AzureWaveTec_78:d7:21 (ec:2e:98:78:d7:21)
        .... ..0. .... .... .... .... = LG bit: Globally unique address (factory default)
        .... ...0 .... .... .... .... = IG bit: Individual address (unicast)
    Type: IPv4 (0x0800)
Internet Protocol Version 4, Src: 192.168.0.6, Dst: 5.252.32.98
    0100 .... = Version: 4
    .... 0101 = Header Length: 20 bytes (5)
    Differentiated Services Field: 0x00 (DSCP: CS0, ECN: Not-ECT)
        0000 00.. = Differentiated Services Codepoint: Default (0)
        .... ..00 = Explicit Congestion Notification: Not ECN-Capable Transport (0)
    Total Length: 1400
    Identification: 0x4598 (17816)
    010. .... = Flags: 0x2, Don't fragment
        0... .... = Reserved bit: Not set
        .1.. .... = Don't fragment: Set
        ..0. .... = More fragments: Not set
    ...0 0000 0000 0000 = Fragment Offset: 0
    Time to Live: 128
    Protocol: TCP (6)
    Header Checksum: 0xc8db [validation disabled]
    [Header checksum status: Unverified]
    Source Address: 192.168.0.6
    Destination Address: 5.252.32.98
Transmission Control Protocol, Src Port: 63778, Dst Port: 443, Seq: 5792, Ack: 3050, Len: 1360
    Source Port: 63778
    Destination Port: 443
    [Stream index: 7]
    [Conversation completeness: Complete, WITH_DATA (31)]
        ..0. .... = RST: Absent
        ...1 .... = FIN: Present
        .... 1... = Data: Present
        .... .1.. = ACK: Present
        .... ..1. = SYN-ACK: Present
        .... ...1 = SYN: Present
        [Completeness Flags: ·FDASS]
    [TCP Segment Len: 1360]
    Sequence Number: 5792    (relative sequence number)
    Sequence Number (raw): 3240816630
    [Next Sequence Number: 7152    (relative sequence number)]
    Acknowledgment Number: 3050    (relative ack number)
    Acknowledgment number (raw): 3540583887
    0101 .... = Header Length: 20 bytes (5)
    Flags: 0x010 (ACK)
        000. .... .... = Reserved: Not set
        ...0 .... .... = Accurate ECN: Not set
        .... 0... .... = Congestion Window Reduced: Not set
        .... .0.. .... = ECN-Echo: Not set
        .... ..0. .... = Urgent: Not set
        .... ...1 .... = Acknowledgment: Set
        .... .... 0... = Push: Not set
        .... .... .0.. = Reset: Not set
        .... .... ..0. = Syn: Not set
        .... .... ...0 = Fin: Not set
        [TCP Flags: ·······A····]
    Window: 515
    [Calculated window size: 131840]
    [Window size scaling factor: 256]
    Checksum: 0x0739 [unverified]
    [Checksum Status: Unverified]
    Urgent Pointer: 0
    [Timestamps]
        [Time since first frame in this TCP stream: 0.802249000 seconds]
        [Time since previous frame in this TCP stream: 0.000000000 seconds]
    [SEQ/ACK analysis]
        [iRTT: 0.260260000 seconds]
        [Bytes in flight: 6845]
        [Bytes sent since last PSH flag: 2720]
    TCP payload (1360 bytes)
    [Reassembled PDU in frame: 170]
    TCP segment data (1360 bytes)

No.     Time           Source                Destination           Protocol Length Info
    154 12.278594      192.168.0.6           5.252.32.98           TCP      1414   63778 → 443 [ACK] Seq=7152 Ack=3050 Win=131840 Len=1360 [TCP segment of a reassembled PDU]

Frame 154: 1414 bytes on wire (11312 bits), 1414 bytes captured (11312 bits) on interface \Device\NPF_{9DA57E6A-DB56-483D-A9F1-101740B9C29A}, id 0
    Section number: 1
    Interface id: 0 (\Device\NPF_{9DA57E6A-DB56-483D-A9F1-101740B9C29A})
        Interface name: \Device\NPF_{9DA57E6A-DB56-483D-A9F1-101740B9C29A}
        Interface description: Wi-Fi
    Encapsulation type: Ethernet (1)
    Arrival Time: Jul 10, 2024 01:01:24.261189000 Hora estándar de Argentina
    UTC Arrival Time: Jul 10, 2024 04:01:24.261189000 UTC
    Epoch Arrival Time: 1720584084.261189000
    [Time shift for this packet: 0.000000000 seconds]
    [Time delta from previous captured frame: 0.000000000 seconds]
    [Time delta from previous displayed frame: 0.000000000 seconds]
    [Time since reference or first frame: 12.278594000 seconds]
    Frame Number: 154
    Frame Length: 1414 bytes (11312 bits)
    Capture Length: 1414 bytes (11312 bits)
    [Frame is marked: False]
    [Frame is ignored: False]
    [Protocols in frame: eth:ethertype:ip:tcp]
    [Coloring Rule Name: TCP]
    [Coloring Rule String: tcp]
Ethernet II, Src: AzureWaveTec_78:d7:21 (ec:2e:98:78:d7:21), Dst: Maxlinear_80:00:00 (00:50:f1:80:00:00)
    Destination: Maxlinear_80:00:00 (00:50:f1:80:00:00)
        Address: Maxlinear_80:00:00 (00:50:f1:80:00:00)
        .... ..0. .... .... .... .... = LG bit: Globally unique address (factory default)
        .... ...0 .... .... .... .... = IG bit: Individual address (unicast)
    Source: AzureWaveTec_78:d7:21 (ec:2e:98:78:d7:21)
        Address: AzureWaveTec_78:d7:21 (ec:2e:98:78:d7:21)
        .... ..0. .... .... .... .... = LG bit: Globally unique address (factory default)
        .... ...0 .... .... .... .... = IG bit: Individual address (unicast)
    Type: IPv4 (0x0800)
Internet Protocol Version 4, Src: 192.168.0.6, Dst: 5.252.32.98
    0100 .... = Version: 4
    .... 0101 = Header Length: 20 bytes (5)
    Differentiated Services Field: 0x00 (DSCP: CS0, ECN: Not-ECT)
        0000 00.. = Differentiated Services Codepoint: Default (0)
        .... ..00 = Explicit Congestion Notification: Not ECN-Capable Transport (0)
    Total Length: 1400
    Identification: 0x4599 (17817)
    010. .... = Flags: 0x2, Don't fragment
        0... .... = Reserved bit: Not set
        .1.. .... = Don't fragment: Set
        ..0. .... = More fragments: Not set
    ...0 0000 0000 0000 = Fragment Offset: 0
    Time to Live: 128
    Protocol: TCP (6)
    Header Checksum: 0xc8da [validation disabled]
    [Header checksum status: Unverified]
    Source Address: 192.168.0.6
    Destination Address: 5.252.32.98
Transmission Control Protocol, Src Port: 63778, Dst Port: 443, Seq: 7152, Ack: 3050, Len: 1360
    Source Port: 63778
    Destination Port: 443
    [Stream index: 7]
    [Conversation completeness: Complete, WITH_DATA (31)]
        ..0. .... = RST: Absent
        ...1 .... = FIN: Present
        .... 1... = Data: Present
        .... .1.. = ACK: Present
        .... ..1. = SYN-ACK: Present
        .... ...1 = SYN: Present
        [Completeness Flags: ·FDASS]
    [TCP Segment Len: 1360]
    Sequence Number: 7152    (relative sequence number)
    Sequence Number (raw): 3240817990
    [Next Sequence Number: 8512    (relative sequence number)]
    Acknowledgment Number: 3050    (relative ack number)
    Acknowledgment number (raw): 3540583887
    0101 .... = Header Length: 20 bytes (5)
    Flags: 0x010 (ACK)
        000. .... .... = Reserved: Not set
        ...0 .... .... = Accurate ECN: Not set
        .... 0... .... = Congestion Window Reduced: Not set
        .... .0.. .... = ECN-Echo: Not set
        .... ..0. .... = Urgent: Not set
        .... ...1 .... = Acknowledgment: Set
        .... .... 0... = Push: Not set
        .... .... .0.. = Reset: Not set
        .... .... ..0. = Syn: Not set
        .... .... ...0 = Fin: Not set
        [TCP Flags: ·······A····]
    Window: 515
    [Calculated window size: 131840]
    [Window size scaling factor: 256]
    Checksum: 0xfe13 [unverified]
    [Checksum Status: Unverified]
    Urgent Pointer: 0
    [Timestamps]
        [Time since first frame in this TCP stream: 0.802249000 seconds]
        [Time since previous frame in this TCP stream: 0.000000000 seconds]
    [SEQ/ACK analysis]
        [iRTT: 0.260260000 seconds]
        [Bytes in flight: 8205]
        [Bytes sent since last PSH flag: 4080]
    TCP payload (1360 bytes)
    [Reassembled PDU in frame: 170]
    TCP segment data (1360 bytes)

No.     Time           Source                Destination           Protocol Length Info
    155 12.278594      192.168.0.6           5.252.32.98           TCP      1414   63778 → 443 [ACK] Seq=8512 Ack=3050 Win=131840 Len=1360 [TCP segment of a reassembled PDU]

Frame 155: 1414 bytes on wire (11312 bits), 1414 bytes captured (11312 bits) on interface \Device\NPF_{9DA57E6A-DB56-483D-A9F1-101740B9C29A}, id 0
    Section number: 1
    Interface id: 0 (\Device\NPF_{9DA57E6A-DB56-483D-A9F1-101740B9C29A})
        Interface name: \Device\NPF_{9DA57E6A-DB56-483D-A9F1-101740B9C29A}
        Interface description: Wi-Fi
    Encapsulation type: Ethernet (1)
    Arrival Time: Jul 10, 2024 01:01:24.261189000 Hora estándar de Argentina
    UTC Arrival Time: Jul 10, 2024 04:01:24.261189000 UTC
    Epoch Arrival Time: 1720584084.261189000
    [Time shift for this packet: 0.000000000 seconds]
    [Time delta from previous captured frame: 0.000000000 seconds]
    [Time delta from previous displayed frame: 0.000000000 seconds]
    [Time since reference or first frame: 12.278594000 seconds]
    Frame Number: 155
    Frame Length: 1414 bytes (11312 bits)
    Capture Length: 1414 bytes (11312 bits)
    [Frame is marked: False]
    [Frame is ignored: False]
    [Protocols in frame: eth:ethertype:ip:tcp]
    [Coloring Rule Name: TCP]
    [Coloring Rule String: tcp]
Ethernet II, Src: AzureWaveTec_78:d7:21 (ec:2e:98:78:d7:21), Dst: Maxlinear_80:00:00 (00:50:f1:80:00:00)
    Destination: Maxlinear_80:00:00 (00:50:f1:80:00:00)
        Address: Maxlinear_80:00:00 (00:50:f1:80:00:00)
        .... ..0. .... .... .... .... = LG bit: Globally unique address (factory default)
        .... ...0 .... .... .... .... = IG bit: Individual address (unicast)
    Source: AzureWaveTec_78:d7:21 (ec:2e:98:78:d7:21)
        Address: AzureWaveTec_78:d7:21 (ec:2e:98:78:d7:21)
        .... ..0. .... .... .... .... = LG bit: Globally unique address (factory default)
        .... ...0 .... .... .... .... = IG bit: Individual address (unicast)
    Type: IPv4 (0x0800)
Internet Protocol Version 4, Src: 192.168.0.6, Dst: 5.252.32.98
    0100 .... = Version: 4
    .... 0101 = Header Length: 20 bytes (5)
    Differentiated Services Field: 0x00 (DSCP: CS0, ECN: Not-ECT)
        0000 00.. = Differentiated Services Codepoint: Default (0)
        .... ..00 = Explicit Congestion Notification: Not ECN-Capable Transport (0)
    Total Length: 1400
    Identification: 0x459a (17818)
    010. .... = Flags: 0x2, Don't fragment
        0... .... = Reserved bit: Not set
        .1.. .... = Don't fragment: Set
        ..0. .... = More fragments: Not set
    ...0 0000 0000 0000 = Fragment Offset: 0
    Time to Live: 128
    Protocol: TCP (6)
    Header Checksum: 0xc8d9 [validation disabled]
    [Header checksum status: Unverified]
    Source Address: 192.168.0.6
    Destination Address: 5.252.32.98
Transmission Control Protocol, Src Port: 63778, Dst Port: 443, Seq: 8512, Ack: 3050, Len: 1360
    Source Port: 63778
    Destination Port: 443
    [Stream index: 7]
    [Conversation completeness: Complete, WITH_DATA (31)]
        ..0. .... = RST: Absent
        ...1 .... = FIN: Present
        .... 1... = Data: Present
        .... .1.. = ACK: Present
        .... ..1. = SYN-ACK: Present
        .... ...1 = SYN: Present
        [Completeness Flags: ·FDASS]
    [TCP Segment Len: 1360]
    Sequence Number: 8512    (relative sequence number)
    Sequence Number (raw): 3240819350
    [Next Sequence Number: 9872    (relative sequence number)]
    Acknowledgment Number: 3050    (relative ack number)
    Acknowledgment number (raw): 3540583887
    0101 .... = Header Length: 20 bytes (5)
    Flags: 0x010 (ACK)
        000. .... .... = Reserved: Not set
        ...0 .... .... = Accurate ECN: Not set
        .... 0... .... = Congestion Window Reduced: Not set
        .... .0.. .... = ECN-Echo: Not set
        .... ..0. .... = Urgent: Not set
        .... ...1 .... = Acknowledgment: Set
        .... .... 0... = Push: Not set
        .... .... .0.. = Reset: Not set
        .... .... ..0. = Syn: Not set
        .... .... ...0 = Fin: Not set
        [TCP Flags: ·······A····]
    Window: 515
    [Calculated window size: 131840]
    [Window size scaling factor: 256]
    Checksum: 0xb5e1 [unverified]
    [Checksum Status: Unverified]
    Urgent Pointer: 0
    [Timestamps]
        [Time since first frame in this TCP stream: 0.802249000 seconds]
        [Time since previous frame in this TCP stream: 0.000000000 seconds]
    [SEQ/ACK analysis]
        [iRTT: 0.260260000 seconds]
        [Bytes in flight: 9565]
        [Bytes sent since last PSH flag: 5440]
    TCP payload (1360 bytes)
    [Reassembled PDU in frame: 170]
    TCP segment data (1360 bytes)

No.     Time           Source                Destination           Protocol Length Info
    156 12.278594      192.168.0.6           5.252.32.98           TCP      1414   63778 → 443 [ACK] Seq=9872 Ack=3050 Win=131840 Len=1360 [TCP segment of a reassembled PDU]

Frame 156: 1414 bytes on wire (11312 bits), 1414 bytes captured (11312 bits) on interface \Device\NPF_{9DA57E6A-DB56-483D-A9F1-101740B9C29A}, id 0
    Section number: 1
    Interface id: 0 (\Device\NPF_{9DA57E6A-DB56-483D-A9F1-101740B9C29A})
        Interface name: \Device\NPF_{9DA57E6A-DB56-483D-A9F1-101740B9C29A}
        Interface description: Wi-Fi
    Encapsulation type: Ethernet (1)
    Arrival Time: Jul 10, 2024 01:01:24.261189000 Hora estándar de Argentina
    UTC Arrival Time: Jul 10, 2024 04:01:24.261189000 UTC
    Epoch Arrival Time: 1720584084.261189000
    [Time shift for this packet: 0.000000000 seconds]
    [Time delta from previous captured frame: 0.000000000 seconds]
    [Time delta from previous displayed frame: 0.000000000 seconds]
    [Time since reference or first frame: 12.278594000 seconds]
    Frame Number: 156
    Frame Length: 1414 bytes (11312 bits)
    Capture Length: 1414 bytes (11312 bits)
    [Frame is marked: False]
    [Frame is ignored: False]
    [Protocols in frame: eth:ethertype:ip:tcp]
    [Coloring Rule Name: TCP]
    [Coloring Rule String: tcp]
Ethernet II, Src: AzureWaveTec_78:d7:21 (ec:2e:98:78:d7:21), Dst: Maxlinear_80:00:00 (00:50:f1:80:00:00)
    Destination: Maxlinear_80:00:00 (00:50:f1:80:00:00)
        Address: Maxlinear_80:00:00 (00:50:f1:80:00:00)
        .... ..0. .... .... .... .... = LG bit: Globally unique address (factory default)
        .... ...0 .... .... .... .... = IG bit: Individual address (unicast)
    Source: AzureWaveTec_78:d7:21 (ec:2e:98:78:d7:21)
        Address: AzureWaveTec_78:d7:21 (ec:2e:98:78:d7:21)
        .... ..0. .... .... .... .... = LG bit: Globally unique address (factory default)
        .... ...0 .... .... .... .... = IG bit: Individual address (unicast)
    Type: IPv4 (0x0800)
Internet Protocol Version 4, Src: 192.168.0.6, Dst: 5.252.32.98
    0100 .... = Version: 4
    .... 0101 = Header Length: 20 bytes (5)
    Differentiated Services Field: 0x00 (DSCP: CS0, ECN: Not-ECT)
        0000 00.. = Differentiated Services Codepoint: Default (0)
        .... ..00 = Explicit Congestion Notification: Not ECN-Capable Transport (0)
    Total Length: 1400
    Identification: 0x459b (17819)
    010. .... = Flags: 0x2, Don't fragment
        0... .... = Reserved bit: Not set
        .1.. .... = Don't fragment: Set
        ..0. .... = More fragments: Not set
    ...0 0000 0000 0000 = Fragment Offset: 0
    Time to Live: 128
    Protocol: TCP (6)
    Header Checksum: 0xc8d8 [validation disabled]
    [Header checksum status: Unverified]
    Source Address: 192.168.0.6
    Destination Address: 5.252.32.98
Transmission Control Protocol, Src Port: 63778, Dst Port: 443, Seq: 9872, Ack: 3050, Len: 1360
    Source Port: 63778
    Destination Port: 443
    [Stream index: 7]
    [Conversation completeness: Complete, WITH_DATA (31)]
        ..0. .... = RST: Absent
        ...1 .... = FIN: Present
        .... 1... = Data: Present
        .... .1.. = ACK: Present
        .... ..1. = SYN-ACK: Present
        .... ...1 = SYN: Present
        [Completeness Flags: ·FDASS]
    [TCP Segment Len: 1360]
    Sequence Number: 9872    (relative sequence number)
    Sequence Number (raw): 3240820710
    [Next Sequence Number: 11232    (relative sequence number)]
    Acknowledgment Number: 3050    (relative ack number)
    Acknowledgment number (raw): 3540583887
    0101 .... = Header Length: 20 bytes (5)
    Flags: 0x010 (ACK)
        000. .... .... = Reserved: Not set
        ...0 .... .... = Accurate ECN: Not set
        .... 0... .... = Congestion Window Reduced: Not set
        .... .0.. .... = ECN-Echo: Not set
        .... ..0. .... = Urgent: Not set
        .... ...1 .... = Acknowledgment: Set
        .... .... 0... = Push: Not set
        .... .... .0.. = Reset: Not set
        .... .... ..0. = Syn: Not set
        .... .... ...0 = Fin: Not set
        [TCP Flags: ·······A····]
    Window: 515
    [Calculated window size: 131840]
    [Window size scaling factor: 256]
    Checksum: 0x8998 [unverified]
    [Checksum Status: Unverified]
    Urgent Pointer: 0
    [Timestamps]
        [Time since first frame in this TCP stream: 0.802249000 seconds]
        [Time since previous frame in this TCP stream: 0.000000000 seconds]
    [SEQ/ACK analysis]
        [iRTT: 0.260260000 seconds]
        [Bytes in flight: 10925]
        [Bytes sent since last PSH flag: 6800]
    TCP payload (1360 bytes)
    [Reassembled PDU in frame: 170]
    TCP segment data (1360 bytes)

No.     Time           Source                Destination           Protocol Length Info
    157 12.278594      192.168.0.6           5.252.32.98           TCP      1414   63778 → 443 [ACK] Seq=11232 Ack=3050 Win=131840 Len=1360 [TCP segment of a reassembled PDU]

Frame 157: 1414 bytes on wire (11312 bits), 1414 bytes captured (11312 bits) on interface \Device\NPF_{9DA57E6A-DB56-483D-A9F1-101740B9C29A}, id 0
    Section number: 1
    Interface id: 0 (\Device\NPF_{9DA57E6A-DB56-483D-A9F1-101740B9C29A})
        Interface name: \Device\NPF_{9DA57E6A-DB56-483D-A9F1-101740B9C29A}
        Interface description: Wi-Fi
    Encapsulation type: Ethernet (1)
    Arrival Time: Jul 10, 2024 01:01:24.261189000 Hora estándar de Argentina
    UTC Arrival Time: Jul 10, 2024 04:01:24.261189000 UTC
    Epoch Arrival Time: 1720584084.261189000
    [Time shift for this packet: 0.000000000 seconds]
    [Time delta from previous captured frame: 0.000000000 seconds]
    [Time delta from previous displayed frame: 0.000000000 seconds]
    [Time since reference or first frame: 12.278594000 seconds]
    Frame Number: 157
    Frame Length: 1414 bytes (11312 bits)
    Capture Length: 1414 bytes (11312 bits)
    [Frame is marked: False]
    [Frame is ignored: False]
    [Protocols in frame: eth:ethertype:ip:tcp]
    [Coloring Rule Name: TCP]
    [Coloring Rule String: tcp]
Ethernet II, Src: AzureWaveTec_78:d7:21 (ec:2e:98:78:d7:21), Dst: Maxlinear_80:00:00 (00:50:f1:80:00:00)
    Destination: Maxlinear_80:00:00 (00:50:f1:80:00:00)
        Address: Maxlinear_80:00:00 (00:50:f1:80:00:00)
        .... ..0. .... .... .... .... = LG bit: Globally unique address (factory default)
        .... ...0 .... .... .... .... = IG bit: Individual address (unicast)
    Source: AzureWaveTec_78:d7:21 (ec:2e:98:78:d7:21)
        Address: AzureWaveTec_78:d7:21 (ec:2e:98:78:d7:21)
        .... ..0. .... .... .... .... = LG bit: Globally unique address (factory default)
        .... ...0 .... .... .... .... = IG bit: Individual address (unicast)
    Type: IPv4 (0x0800)
Internet Protocol Version 4, Src: 192.168.0.6, Dst: 5.252.32.98
    0100 .... = Version: 4
    .... 0101 = Header Length: 20 bytes (5)
    Differentiated Services Field: 0x00 (DSCP: CS0, ECN: Not-ECT)
        0000 00.. = Differentiated Services Codepoint: Default (0)
        .... ..00 = Explicit Congestion Notification: Not ECN-Capable Transport (0)
    Total Length: 1400
    Identification: 0x459c (17820)
    010. .... = Flags: 0x2, Don't fragment
        0... .... = Reserved bit: Not set
        .1.. .... = Don't fragment: Set
        ..0. .... = More fragments: Not set
    ...0 0000 0000 0000 = Fragment Offset: 0
    Time to Live: 128
    Protocol: TCP (6)
    Header Checksum: 0xc8d7 [validation disabled]
    [Header checksum status: Unverified]
    Source Address: 192.168.0.6
    Destination Address: 5.252.32.98
Transmission Control Protocol, Src Port: 63778, Dst Port: 443, Seq: 11232, Ack: 3050, Len: 1360
    Source Port: 63778
    Destination Port: 443
    [Stream index: 7]
    [Conversation completeness: Complete, WITH_DATA (31)]
        ..0. .... = RST: Absent
        ...1 .... = FIN: Present
        .... 1... = Data: Present
        .... .1.. = ACK: Present
        .... ..1. = SYN-ACK: Present
        .... ...1 = SYN: Present
        [Completeness Flags: ·FDASS]
    [TCP Segment Len: 1360]
    Sequence Number: 11232    (relative sequence number)
    Sequence Number (raw): 3240822070
    [Next Sequence Number: 12592    (relative sequence number)]
    Acknowledgment Number: 3050    (relative ack number)
    Acknowledgment number (raw): 3540583887
    0101 .... = Header Length: 20 bytes (5)
    Flags: 0x010 (ACK)
        000. .... .... = Reserved: Not set
        ...0 .... .... = Accurate ECN: Not set
        .... 0... .... = Congestion Window Reduced: Not set
        .... .0.. .... = ECN-Echo: Not set
        .... ..0. .... = Urgent: Not set
        .... ...1 .... = Acknowledgment: Set
        .... .... 0... = Push: Not set
        .... .... .0.. = Reset: Not set
        .... .... ..0. = Syn: Not set
        .... .... ...0 = Fin: Not set
        [TCP Flags: ·······A····]
    Window: 515
    [Calculated window size: 131840]
    [Window size scaling factor: 256]
    Checksum: 0xe932 [unverified]
    [Checksum Status: Unverified]
    Urgent Pointer: 0
    [Timestamps]
        [Time since first frame in this TCP stream: 0.802249000 seconds]
        [Time since previous frame in this TCP stream: 0.000000000 seconds]
    [SEQ/ACK analysis]
        [iRTT: 0.260260000 seconds]
        [Bytes in flight: 12285]
        [Bytes sent since last PSH flag: 8160]
    TCP payload (1360 bytes)
    [Reassembled PDU in frame: 170]
    TCP segment data (1360 bytes)

No.     Time           Source                Destination           Protocol Length Info
    158 12.278594      192.168.0.6           5.252.32.98           TCP      1414   63778 → 443 [ACK] Seq=12592 Ack=3050 Win=131840 Len=1360 [TCP segment of a reassembled PDU]

Frame 158: 1414 bytes on wire (11312 bits), 1414 bytes captured (11312 bits) on interface \Device\NPF_{9DA57E6A-DB56-483D-A9F1-101740B9C29A}, id 0
    Section number: 1
    Interface id: 0 (\Device\NPF_{9DA57E6A-DB56-483D-A9F1-101740B9C29A})
        Interface name: \Device\NPF_{9DA57E6A-DB56-483D-A9F1-101740B9C29A}
        Interface description: Wi-Fi
    Encapsulation type: Ethernet (1)
    Arrival Time: Jul 10, 2024 01:01:24.261189000 Hora estándar de Argentina
    UTC Arrival Time: Jul 10, 2024 04:01:24.261189000 UTC
    Epoch Arrival Time: 1720584084.261189000
    [Time shift for this packet: 0.000000000 seconds]
    [Time delta from previous captured frame: 0.000000000 seconds]
    [Time delta from previous displayed frame: 0.000000000 seconds]
    [Time since reference or first frame: 12.278594000 seconds]
    Frame Number: 158
    Frame Length: 1414 bytes (11312 bits)
    Capture Length: 1414 bytes (11312 bits)
    [Frame is marked: False]
    [Frame is ignored: False]
    [Protocols in frame: eth:ethertype:ip:tcp]
    [Coloring Rule Name: TCP]
    [Coloring Rule String: tcp]
Ethernet II, Src: AzureWaveTec_78:d7:21 (ec:2e:98:78:d7:21), Dst: Maxlinear_80:00:00 (00:50:f1:80:00:00)
    Destination: Maxlinear_80:00:00 (00:50:f1:80:00:00)
        Address: Maxlinear_80:00:00 (00:50:f1:80:00:00)
        .... ..0. .... .... .... .... = LG bit: Globally unique address (factory default)
        .... ...0 .... .... .... .... = IG bit: Individual address (unicast)
    Source: AzureWaveTec_78:d7:21 (ec:2e:98:78:d7:21)
        Address: AzureWaveTec_78:d7:21 (ec:2e:98:78:d7:21)
        .... ..0. .... .... .... .... = LG bit: Globally unique address (factory default)
        .... ...0 .... .... .... .... = IG bit: Individual address (unicast)
    Type: IPv4 (0x0800)
Internet Protocol Version 4, Src: 192.168.0.6, Dst: 5.252.32.98
    0100 .... = Version: 4
    .... 0101 = Header Length: 20 bytes (5)
    Differentiated Services Field: 0x00 (DSCP: CS0, ECN: Not-ECT)
        0000 00.. = Differentiated Services Codepoint: Default (0)
        .... ..00 = Explicit Congestion Notification: Not ECN-Capable Transport (0)
    Total Length: 1400
    Identification: 0x459d (17821)
    010. .... = Flags: 0x2, Don't fragment
        0... .... = Reserved bit: Not set
        .1.. .... = Don't fragment: Set
        ..0. .... = More fragments: Not set
    ...0 0000 0000 0000 = Fragment Offset: 0
    Time to Live: 128
    Protocol: TCP (6)
    Header Checksum: 0xc8d6 [validation disabled]
    [Header checksum status: Unverified]
    Source Address: 192.168.0.6
    Destination Address: 5.252.32.98
Transmission Control Protocol, Src Port: 63778, Dst Port: 443, Seq: 12592, Ack: 3050, Len: 1360
    Source Port: 63778
    Destination Port: 443
    [Stream index: 7]
    [Conversation completeness: Complete, WITH_DATA (31)]
        ..0. .... = RST: Absent
        ...1 .... = FIN: Present
        .... 1... = Data: Present
        .... .1.. = ACK: Present
        .... ..1. = SYN-ACK: Present
        .... ...1 = SYN: Present
        [Completeness Flags: ·FDASS]
    [TCP Segment Len: 1360]
    Sequence Number: 12592    (relative sequence number)
    Sequence Number (raw): 3240823430
    [Next Sequence Number: 13952    (relative sequence number)]
    Acknowledgment Number: 3050    (relative ack number)
    Acknowledgment number (raw): 3540583887
    0101 .... = Header Length: 20 bytes (5)
    Flags: 0x010 (ACK)
        000. .... .... = Reserved: Not set
        ...0 .... .... = Accurate ECN: Not set
        .... 0... .... = Congestion Window Reduced: Not set
        .... .0.. .... = ECN-Echo: Not set
        .... ..0. .... = Urgent: Not set
        .... ...1 .... = Acknowledgment: Set
        .... .... 0... = Push: Not set
        .... .... .0.. = Reset: Not set
        .... .... ..0. = Syn: Not set
        .... .... ...0 = Fin: Not set
        [TCP Flags: ·······A····]
    Window: 515
    [Calculated window size: 131840]
    [Window size scaling factor: 256]
    Checksum: 0x1d57 [unverified]
    [Checksum Status: Unverified]
    Urgent Pointer: 0
    [Timestamps]
        [Time since first frame in this TCP stream: 0.802249000 seconds]
        [Time since previous frame in this TCP stream: 0.000000000 seconds]
    [SEQ/ACK analysis]
        [iRTT: 0.260260000 seconds]
        [Bytes in flight: 13645]
        [Bytes sent since last PSH flag: 9520]
    TCP payload (1360 bytes)
    [Reassembled PDU in frame: 170]
    TCP segment data (1360 bytes)

No.     Time           Source                Destination           Protocol Length Info
    159 12.481694      5.252.32.98           192.168.0.6           TCP      105    [TCP Spurious Retransmission] 443 → 63778 [PSH, ACK] Seq=2999 Ack=307 Win=67072 Len=51

Frame 159: 105 bytes on wire (840 bits), 105 bytes captured (840 bits) on interface \Device\NPF_{9DA57E6A-DB56-483D-A9F1-101740B9C29A}, id 0
    Section number: 1
    Interface id: 0 (\Device\NPF_{9DA57E6A-DB56-483D-A9F1-101740B9C29A})
        Interface name: \Device\NPF_{9DA57E6A-DB56-483D-A9F1-101740B9C29A}
        Interface description: Wi-Fi
    Encapsulation type: Ethernet (1)
    Arrival Time: Jul 10, 2024 01:01:24.464289000 Hora estándar de Argentina
    UTC Arrival Time: Jul 10, 2024 04:01:24.464289000 UTC
    Epoch Arrival Time: 1720584084.464289000
    [Time shift for this packet: 0.000000000 seconds]
    [Time delta from previous captured frame: 0.203100000 seconds]
    [Time delta from previous displayed frame: 0.203100000 seconds]
    [Time since reference or first frame: 12.481694000 seconds]
    Frame Number: 159
    Frame Length: 105 bytes (840 bits)
    Capture Length: 105 bytes (840 bits)
    [Frame is marked: False]
    [Frame is ignored: False]
    [Protocols in frame: eth:ethertype:ip:tcp]
    [Coloring Rule Name: Bad TCP]
    [Coloring Rule String: tcp.analysis.flags && !tcp.analysis.window_update && !tcp.analysis.keep_alive && !tcp.analysis.keep_alive_ack]
Ethernet II, Src: Maxlinear_80:00:00 (00:50:f1:80:00:00), Dst: AzureWaveTec_78:d7:21 (ec:2e:98:78:d7:21)
    Destination: AzureWaveTec_78:d7:21 (ec:2e:98:78:d7:21)
        Address: AzureWaveTec_78:d7:21 (ec:2e:98:78:d7:21)
        .... ..0. .... .... .... .... = LG bit: Globally unique address (factory default)
        .... ...0 .... .... .... .... = IG bit: Individual address (unicast)
    Source: Maxlinear_80:00:00 (00:50:f1:80:00:00)
        Address: Maxlinear_80:00:00 (00:50:f1:80:00:00)
        .... ..0. .... .... .... .... = LG bit: Globally unique address (factory default)
        .... ...0 .... .... .... .... = IG bit: Individual address (unicast)
    Type: IPv4 (0x0800)
Internet Protocol Version 4, Src: 5.252.32.98, Dst: 192.168.0.6
    0100 .... = Version: 4
    .... 0101 = Header Length: 20 bytes (5)
    Differentiated Services Field: 0x50 (DSCP: AF22, ECN: Not-ECT)
        0101 00.. = Differentiated Services Codepoint: Assured Forwarding 22 (20)
        .... ..00 = Explicit Congestion Notification: Not ECN-Capable Transport (0)
    Total Length: 91
    Identification: 0x8093 (32915)
    010. .... = Flags: 0x2, Don't fragment
        0... .... = Reserved bit: Not set
        .1.. .... = Don't fragment: Set
        ..0. .... = More fragments: Not set
    ...0 0000 0000 0000 = Fragment Offset: 0
    Time to Live: 55
    Protocol: TCP (6)
    Header Checksum: 0xdbad [validation disabled]
    [Header checksum status: Unverified]
    Source Address: 5.252.32.98
    Destination Address: 192.168.0.6
Transmission Control Protocol, Src Port: 443, Dst Port: 63778, Seq: 2999, Ack: 307, Len: 51
    Source Port: 443
    Destination Port: 63778
    [Stream index: 7]
    [Conversation completeness: Complete, WITH_DATA (31)]
        ..0. .... = RST: Absent
        ...1 .... = FIN: Present
        .... 1... = Data: Present
        .... .1.. = ACK: Present
        .... ..1. = SYN-ACK: Present
        .... ...1 = SYN: Present
        [Completeness Flags: ·FDASS]
    [TCP Segment Len: 51]
    Sequence Number: 2999    (relative sequence number)
    Sequence Number (raw): 3540583836
    [Next Sequence Number: 3050    (relative sequence number)]
    Acknowledgment Number: 307    (relative ack number)
    Acknowledgment number (raw): 3240811145
    0101 .... = Header Length: 20 bytes (5)
    Flags: 0x018 (PSH, ACK)
        000. .... .... = Reserved: Not set
        ...0 .... .... = Accurate ECN: Not set
        .... 0... .... = Congestion Window Reduced: Not set
        .... .0.. .... = ECN-Echo: Not set
        .... ..0. .... = Urgent: Not set
        .... ...1 .... = Acknowledgment: Set
        .... .... 1... = Push: Set
        .... .... .0.. = Reset: Not set
        .... .... ..0. = Syn: Not set
        .... .... ...0 = Fin: Not set
        [TCP Flags: ·······AP···]
    Window: 131
    [Calculated window size: 67072]
    [Window size scaling factor: 512]
    Checksum: 0x9add [unverified]
    [Checksum Status: Unverified]
    Urgent Pointer: 0
    [Timestamps]
        [Time since first frame in this TCP stream: 1.005349000 seconds]
        [Time since previous frame in this TCP stream: 0.203100000 seconds]
    [SEQ/ACK analysis]
        [iRTT: 0.260260000 seconds]
        [Bytes in flight: 51]
        [Bytes sent since last PSH flag: 51]
        [TCP Analysis Flags]
            [Expert Info (Note/Sequence): This frame is a (suspected) spurious retransmission]
                [This frame is a (suspected) spurious retransmission]
                [Severity level: Note]
                [Group: Sequence]
            [Expert Info (Note/Sequence): This frame is a (suspected) retransmission]
                [This frame is a (suspected) retransmission]
                [Severity level: Note]
                [Group: Sequence]
    TCP payload (51 bytes)
    Retransmitted TCP segment data (51 bytes)

No.     Time           Source                Destination           Protocol Length Info
    160 12.481753      192.168.0.6           5.252.32.98           TCP      66     [TCP Dup ACK 148#1] 63778 → 443 [ACK] Seq=13952 Ack=3050 Win=131840 Len=0 SLE=2999 SRE=3050

Frame 160: 66 bytes on wire (528 bits), 66 bytes captured (528 bits) on interface \Device\NPF_{9DA57E6A-DB56-483D-A9F1-101740B9C29A}, id 0
    Section number: 1
    Interface id: 0 (\Device\NPF_{9DA57E6A-DB56-483D-A9F1-101740B9C29A})
        Interface name: \Device\NPF_{9DA57E6A-DB56-483D-A9F1-101740B9C29A}
        Interface description: Wi-Fi
    Encapsulation type: Ethernet (1)
    Arrival Time: Jul 10, 2024 01:01:24.464348000 Hora estándar de Argentina
    UTC Arrival Time: Jul 10, 2024 04:01:24.464348000 UTC
    Epoch Arrival Time: 1720584084.464348000
    [Time shift for this packet: 0.000000000 seconds]
    [Time delta from previous captured frame: 0.000059000 seconds]
    [Time delta from previous displayed frame: 0.000059000 seconds]
    [Time since reference or first frame: 12.481753000 seconds]
    Frame Number: 160
    Frame Length: 66 bytes (528 bits)
    Capture Length: 66 bytes (528 bits)
    [Frame is marked: False]
    [Frame is ignored: False]
    [Protocols in frame: eth:ethertype:ip:tcp]
    [Coloring Rule Name: Bad TCP]
    [Coloring Rule String: tcp.analysis.flags && !tcp.analysis.window_update && !tcp.analysis.keep_alive && !tcp.analysis.keep_alive_ack]
Ethernet II, Src: AzureWaveTec_78:d7:21 (ec:2e:98:78:d7:21), Dst: Maxlinear_80:00:00 (00:50:f1:80:00:00)
    Destination: Maxlinear_80:00:00 (00:50:f1:80:00:00)
        Address: Maxlinear_80:00:00 (00:50:f1:80:00:00)
        .... ..0. .... .... .... .... = LG bit: Globally unique address (factory default)
        .... ...0 .... .... .... .... = IG bit: Individual address (unicast)
    Source: AzureWaveTec_78:d7:21 (ec:2e:98:78:d7:21)
        Address: AzureWaveTec_78:d7:21 (ec:2e:98:78:d7:21)
        .... ..0. .... .... .... .... = LG bit: Globally unique address (factory default)
        .... ...0 .... .... .... .... = IG bit: Individual address (unicast)
    Type: IPv4 (0x0800)
Internet Protocol Version 4, Src: 192.168.0.6, Dst: 5.252.32.98
    0100 .... = Version: 4
    .... 0101 = Header Length: 20 bytes (5)
    Differentiated Services Field: 0x00 (DSCP: CS0, ECN: Not-ECT)
        0000 00.. = Differentiated Services Codepoint: Default (0)
        .... ..00 = Explicit Congestion Notification: Not ECN-Capable Transport (0)
    Total Length: 52
    Identification: 0x459e (17822)
    010. .... = Flags: 0x2, Don't fragment
        0... .... = Reserved bit: Not set
        .1.. .... = Don't fragment: Set
        ..0. .... = More fragments: Not set
    ...0 0000 0000 0000 = Fragment Offset: 0
    Time to Live: 128
    Protocol: TCP (6)
    Header Checksum: 0xce19 [validation disabled]
    [Header checksum status: Unverified]
    Source Address: 192.168.0.6
    Destination Address: 5.252.32.98
Transmission Control Protocol, Src Port: 63778, Dst Port: 443, Seq: 13952, Ack: 3050, Len: 0
    Source Port: 63778
    Destination Port: 443
    [Stream index: 7]
    [Conversation completeness: Complete, WITH_DATA (31)]
        ..0. .... = RST: Absent
        ...1 .... = FIN: Present
        .... 1... = Data: Present
        .... .1.. = ACK: Present
        .... ..1. = SYN-ACK: Present
        .... ...1 = SYN: Present
        [Completeness Flags: ·FDASS]
    [TCP Segment Len: 0]
    Sequence Number: 13952    (relative sequence number)
    Sequence Number (raw): 3240824790
    [Next Sequence Number: 13952    (relative sequence number)]
    Acknowledgment Number: 3050    (relative ack number)
    Acknowledgment number (raw): 3540583887
    1000 .... = Header Length: 32 bytes (8)