 Total Length: 1400
    Identification: 0x45a4 (17828)
    010. .... = Flags: 0x2, Don't fragment
        0... .... = Reserved bit: Not set
        .1.. .... = Don't fragment: Set
        ..0. .... = More fragments: Not set
    ...0 0000 0000 0000 = Fragment Offset: 0
    Time to Live: 128
    Protocol: TCP (6)
    Header Checksum: 0xc8cf [validation disabled]
    [Header checksum status: Unverified]
    Source Address: 192.168.0.6
    Destination Address: 5.252.32.98
Transmission Control Protocol, Src Port: 63778, Dst Port: 443, Seq: 20752, Ack: 3050, Len: 1360
    Source Port: 63778
    Destination Port: 443
    [Stream index: 7]
    [Conversation completeness: Complete, WITH_DATA (31)]
        ..0. .... = RST: Absent
        ...1 .... = FIN: Present
        .... 1... = Data: Present
        .... .1.. = ACK: Present
        .... ..1. = SYN-ACK: Present
        .... ...1 = SYN: Present
        [Completeness Flags: ·FDASS]
    [TCP Segment Len: 1360]
    Sequence Number: 20752    (relative sequence number)
    Sequence Number (raw): 3240831590
    [Next Sequence Number: 22112    (relative sequence number)]
    Acknowledgment Number: 3050    (relative ack number)
    Acknowledgment number (raw): 3540583887
    0101 .... = Header Length: 20 bytes (5)
    Flags: 0x018 (PSH, ACK)
        000. .... .... = Reserved: Not set
        ...0 .... .... = Accurate ECN: Not set
        .... 0... .... = Congestion Window Reduced: Not set
        .... .0.. .... = ECN-Echo: Not set
        .... ..0. .... = Urgent: Not set
        .... ...1 .... = Acknowledgment: Set
        .... .... 1... = Push: Set
        .... .... .0.. = Reset: Not set
        .... .... ..0. = Syn: Not set
        .... .... ...0 = Fin: Not set
        [TCP Flags: ·······AP···]
    Window: 515
    [Calculated window size: 131840]
    [Window size scaling factor: 256]
    Checksum: 0xca18 [unverified]
    [Checksum Status: Unverified]
    Urgent Pointer: 0
    [Timestamps]
        [Time since first frame in this TCP stream: 1.061605000 seconds]
        [Time since previous frame in this TCP stream: 0.000000000 seconds]
    [SEQ/ACK analysis]
        [iRTT: 0.260260000 seconds]
        [Bytes in flight: 12240]
        [Bytes sent since last PSH flag: 17680]
    TCP payload (1360 bytes)
    TCP segment data (64 bytes)
    [Reassembled PDU in frame: 183]
    TCP segment data (1296 bytes)
[13 Reassembled TCP Segments (16384 bytes): #152(1360), #153(1360), #154(1360), #155(1360), #156(1360), #157(1360), #158(1360), #165(1360), #166(1360), #167(1360), #168(1360), #169(1360), #170(64)]
    [Frame: 152, payload: 0-1359 (1360 bytes)]
    [Frame: 153, payload: 1360-2719 (1360 bytes)]
    [Frame: 154, payload: 2720-4079 (1360 bytes)]
    [Frame: 155, payload: 4080-5439 (1360 bytes)]
    [Frame: 156, payload: 5440-6799 (1360 bytes)]
    [Frame: 157, payload: 6800-8159 (1360 bytes)]
    [Frame: 158, payload: 8160-9519 (1360 bytes)]
    [Frame: 165, payload: 9520-10879 (1360 bytes)]
    [Frame: 166, payload: 10880-12239 (1360 bytes)]
    [Frame: 167, payload: 12240-13599 (1360 bytes)]
    [Frame: 168, payload: 13600-14959 (1360 bytes)]
    [Frame: 169, payload: 14960-16319 (1360 bytes)]
    [Frame: 170, payload: 16320-16383 (64 bytes)]
    [Segment count: 13]
    [Reassembled TCP length: 16384]
    [Reassembled TCP Data [truncated]: 1703033ffb000000000000000231e31f6ad96d9f8694bfff4fadfc15258fd9d804e17fb2eec59547d2a421d8d7a8604b305e8c9a7519605b686fd66bc80d15056a8ea4d841a6bdb5b17154b88d9724f503708b3ca6d74c8ef50fa04fbde0be9e470e49183c547]
Transport Layer Security
    TLSv1.2 Record Layer: Application Data Protocol: Hypertext Transfer Protocol
        Content Type: Application Data (23)
        Version: TLS 1.2 (0x0303)
        Length: 16379
        Encrypted Application Data [truncated]: 000000000000000231e31f6ad96d9f8694bfff4fadfc15258fd9d804e17fb2eec59547d2a421d8d7a8604b305e8c9a7519605b686fd66bc80d15056a8ea4d841a6bdb5b17154b88d9724f503708b3ca6d74c8ef50fa04fbde0be9e470e49183c547b8bd
        [Application Data Protocol: Hypertext Transfer Protocol]

No.     Time           Source                Destination           Protocol Length Info
    171 12.537950      192.168.0.6           5.252.32.98           TCP      1414   63778 → 443 [ACK] Seq=22112 Ack=3050 Win=131840 Len=1360 [TCP segment of a reassembled PDU]

Frame 171: 1414 bytes on wire (11312 bits), 1414 bytes captured (11312 bits) on interface \Device\NPF_{9DA57E6A-DB56-483D-A9F1-101740B9C29A}, id 0
    Section number: 1
    Interface id: 0 (\Device\NPF_{9DA57E6A-DB56-483D-A9F1-101740B9C29A})
        Interface name: \Device\NPF_{9DA57E6A-DB56-483D-A9F1-101740B9C29A}
        Interface description: Wi-Fi
    Encapsulation type: Ethernet (1)
    Arrival Time: Jul 10, 2024 01:01:24.520545000 Hora estándar de Argentina
    UTC Arrival Time: Jul 10, 2024 04:01:24.520545000 UTC
    Epoch Arrival Time: 1720584084.520545000
    [Time shift for this packet: 0.000000000 seconds]
    [Time delta from previous captured frame: 0.000000000 seconds]
    [Time delta from previous displayed frame: 0.000000000 seconds]
    [Time since reference or first frame: 12.537950000 seconds]
    Frame Number: 171
    Frame Length: 1414 bytes (11312 bits)
    Capture Length: 1414 bytes (11312 bits)
    [Frame is marked: False]
    [Frame is ignored: False]
    [Protocols in frame: eth:ethertype:ip:tcp]
    [Coloring Rule Name: TCP]
    [Coloring Rule String: tcp]
Ethernet II, Src: AzureWaveTec_78:d7:21 (ec:2e:98:78:d7:21), Dst: Maxlinear_80:00:00 (00:50:f1:80:00:00)
    Destination: Maxlinear_80:00:00 (00:50:f1:80:00:00)
        Address: Maxlinear_80:00:00 (00:50:f1:80:00:00)
        .... ..0. .... .... .... .... = LG bit: Globally unique address (factory default)
        .... ...0 .... .... .... .... = IG bit: Individual address (unicast)
    Source: AzureWaveTec_78:d7:21 (ec:2e:98:78:d7:21)
        Address: AzureWaveTec_78:d7:21 (ec:2e:98:78:d7:21)
        .... ..0. .... .... .... .... = LG bit: Globally unique address (factory default)
        .... ...0 .... .... .... .... = IG bit: Individual address (unicast)
    Type: IPv4 (0x0800)
Internet Protocol Version 4, Src: 192.168.0.6, Dst: 5.252.32.98
    0100 .... = Version: 4
    .... 0101 = Header Length: 20 bytes (5)
    Differentiated Services Field: 0x00 (DSCP: CS0, ECN: Not-ECT)
        0000 00.. = Differentiated Services Codepoint: Default (0)
        .... ..00 = Explicit Congestion Notification: Not ECN-Capable Transport (0)
    Total Length: 1400
    Identification: 0x45a5 (17829)
    010. .... = Flags: 0x2, Don't fragment
        0... .... = Reserved bit: Not set
        .1.. .... = Don't fragment: Set
        ..0. .... = More fragments: Not set
    ...0 0000 0000 0000 = Fragment Offset: 0
    Time to Live: 128
    Protocol: TCP (6)
    Header Checksum: 0xc8ce [validation disabled]
    [Header checksum status: Unverified]
    Source Address: 192.168.0.6
    Destination Address: 5.252.32.98
Transmission Control Protocol, Src Port: 63778, Dst Port: 443, Seq: 22112, Ack: 3050, Len: 1360
    Source Port: 63778
    Destination Port: 443
    [Stream index: 7]
    [Conversation completeness: Complete, WITH_DATA (31)]
        ..0. .... = RST: Absent
        ...1 .... = FIN: Present
        .... 1... = Data: Present
        .... .1.. = ACK: Present
        .... ..1. = SYN-ACK: Present
        .... ...1 = SYN: Present
        [Completeness Flags: ·FDASS]
    [TCP Segment Len: 1360]
    Sequence Number: 22112    (relative sequence number)
    Sequence Number (raw): 3240832950
    [Next Sequence Number: 23472    (relative sequence number)]
    Acknowledgment Number: 3050    (relative ack number)
    Acknowledgment number (raw): 3540583887
    0101 .... = Header Length: 20 bytes (5)
    Flags: 0x010 (ACK)
        000. .... .... = Reserved: Not set
        ...0 .... .... = Accurate ECN: Not set
        .... 0... .... = Congestion Window Reduced: Not set
        .... .0.. .... = ECN-Echo: Not set
        .... ..0. .... = Urgent: Not set
        .... ...1 .... = Acknowledgment: Set
        .... .... 0... = Push: Not set
        .... .... .0.. = Reset: Not set
        .... .... ..0. = Syn: Not set
        .... .... ...0 = Fin: Not set
        [TCP Flags: ·······A····]
    Window: 515
    [Calculated window size: 131840]
    [Window size scaling factor: 256]
    Checksum: 0xda69 [unverified]
    [Checksum Status: Unverified]
    Urgent Pointer: 0
    [Timestamps]
        [Time since first frame in this TCP stream: 1.061605000 seconds]
        [Time since previous frame in this TCP stream: 0.000000000 seconds]
    [SEQ/ACK analysis]
        [iRTT: 0.260260000 seconds]
        [Bytes in flight: 13600]
        [Bytes sent since last PSH flag: 1360]
    TCP payload (1360 bytes)
    [Reassembled PDU in frame: 183]
    TCP segment data (1360 bytes)

No.     Time           Source                Destination           Protocol Length Info
    172 12.537950      192.168.0.6           5.252.32.98           TCP      1414   63778 → 443 [ACK] Seq=23472 Ack=3050 Win=131840 Len=1360 [TCP segment of a reassembled PDU]

Frame 172: 1414 bytes on wire (11312 bits), 1414 bytes captured (11312 bits) on interface \Device\NPF_{9DA57E6A-DB56-483D-A9F1-101740B9C29A}, id 0
    Section number: 1
    Interface id: 0 (\Device\NPF_{9DA57E6A-DB56-483D-A9F1-101740B9C29A})
        Interface name: \Device\NPF_{9DA57E6A-DB56-483D-A9F1-101740B9C29A}
        Interface description: Wi-Fi
    Encapsulation type: Ethernet (1)
    Arrival Time: Jul 10, 2024 01:01:24.520545000 Hora estándar de Argentina
    UTC Arrival Time: Jul 10, 2024 04:01:24.520545000 UTC
    Epoch Arrival Time: 1720584084.520545000
    [Time shift for this packet: 0.000000000 seconds]
    [Time delta from previous captured frame: 0.000000000 seconds]
    [Time delta from previous displayed frame: 0.000000000 seconds]
    [Time since reference or first frame: 12.537950000 seconds]
    Frame Number: 172
    Frame Length: 1414 bytes (11312 bits)
    Capture Length: 1414 bytes (11312 bits)
    [Frame is marked: False]
    [Frame is ignored: False]
    [Protocols in frame: eth:ethertype:ip:tcp]
    [Coloring Rule Name: TCP]
    [Coloring Rule String: tcp]
Ethernet II, Src: AzureWaveTec_78:d7:21 (ec:2e:98:78:d7:21), Dst: Maxlinear_80:00:00 (00:50:f1:80:00:00)
    Destination: Maxlinear_80:00:00 (00:50:f1:80:00:00)
        Address: Maxlinear_80:00:00 (00:50:f1:80:00:00)
        .... ..0. .... .... .... .... = LG bit: Globally unique address (factory default)
        .... ...0 .... .... .... .... = IG bit: Individual address (unicast)
    Source: AzureWaveTec_78:d7:21 (ec:2e:98:78:d7:21)
        Address: AzureWaveTec_78:d7:21 (ec:2e:98:78:d7:21)
        .... ..0. .... .... .... .... = LG bit: Globally unique address (factory default)
        .... ...0 .... .... .... .... = IG bit: Individual address (unicast)
    Type: IPv4 (0x0800)
Internet Protocol Version 4, Src: 192.168.0.6, Dst: 5.252.32.98
    0100 .... = Version: 4
    .... 0101 = Header Length: 20 bytes (5)
    Differentiated Services Field: 0x00 (DSCP: CS0, ECN: Not-ECT)
        0000 00.. = Differentiated Services Codepoint: Default (0)
        .... ..00 = Explicit Congestion Notification: Not ECN-Capable Transport (0)
    Total Length: 1400
    Identification: 0x45a6 (17830)
    010. .... = Flags: 0x2, Don't fragment
        0... .... = Reserved bit: Not set
        .1.. .... = Don't fragment: Set
        ..0. .... = More fragments: Not set
    ...0 0000 0000 0000 = Fragment Offset: 0
    Time to Live: 128
    Protocol: TCP (6)
    Header Checksum: 0xc8cd [validation disabled]
    [Header checksum status: Unverified]
    Source Address: 192.168.0.6
    Destination Address: 5.252.32.98
Transmission Control Protocol, Src Port: 63778, Dst Port: 443, Seq: 23472, Ack: 3050, Len: 1360
    Source Port: 63778
    Destination Port: 443
    [Stream index: 7]
    [Conversation completeness: Complete, WITH_DATA (31)]
        ..0. .... = RST: Absent
        ...1 .... = FIN: Present
        .... 1... = Data: Present
        .... .1.. = ACK: Present
        .... ..1. = SYN-ACK: Present
        .... ...1 = SYN: Present
        [Completeness Flags: ·FDASS]
    [TCP Segment Len: 1360]
    Sequence Number: 23472    (relative sequence number)
    Sequence Number (raw): 3240834310
    [Next Sequence Number: 24832    (relative sequence number)]
    Acknowledgment Number: 3050    (relative ack number)
    Acknowledgment number (raw): 3540583887
    0101 .... = Header Length: 20 bytes (5)
    Flags: 0x010 (ACK)
        000. .... .... = Reserved: Not set
        ...0 .... .... = Accurate ECN: Not set
        .... 0... .... = Congestion Window Reduced: Not set
        .... .0.. .... = ECN-Echo: Not set
        .... ..0. .... = Urgent: Not set
        .... ...1 .... = Acknowledgment: Set
        .... .... 0... = Push: Not set
        .... .... .0.. = Reset: Not set
        .... .... ..0. = Syn: Not set
        .... .... ...0 = Fin: Not set
        [TCP Flags: ·······A····]
    Window: 515
    [Calculated window size: 131840]
    [Window size scaling factor: 256]
    Checksum: 0x7565 [unverified]
    [Checksum Status: Unverified]
    Urgent Pointer: 0
    [Timestamps]
        [Time since first frame in this TCP stream: 1.061605000 seconds]
        [Time since previous frame in this TCP stream: 0.000000000 seconds]
    [SEQ/ACK analysis]
        [iRTT: 0.260260000 seconds]
        [Bytes in flight: 14960]
        [Bytes sent since last PSH flag: 2720]
    TCP payload (1360 bytes)
    [Reassembled PDU in frame: 183]
    TCP segment data (1360 bytes)

No.     Time           Source                Destination           Protocol Length Info
    173 12.537950      192.168.0.6           5.252.32.98           TCP      1414   63778 → 443 [ACK] Seq=24832 Ack=3050 Win=131840 Len=1360 [TCP segment of a reassembled PDU]

Frame 173: 1414 bytes on wire (11312 bits), 1414 bytes captured (11312 bits) on interface \Device\NPF_{9DA57E6A-DB56-483D-A9F1-101740B9C29A}, id 0
    Section number: 1
    Interface id: 0 (\Device\NPF_{9DA57E6A-DB56-483D-A9F1-101740B9C29A})
        Interface name: \Device\NPF_{9DA57E6A-DB56-483D-A9F1-101740B9C29A}
        Interface description: Wi-Fi
    Encapsulation type: Ethernet (1)
    Arrival Time: Jul 10, 2024 01:01:24.520545000 Hora estándar de Argentina
    UTC Arrival Time: Jul 10, 2024 04:01:24.520545000 UTC
    Epoch Arrival Time: 1720584084.520545000
    [Time shift for this packet: 0.000000000 seconds]
    [Time delta from previous captured frame: 0.000000000 seconds]
    [Time delta from previous displayed frame: 0.000000000 seconds]
    [Time since reference or first frame: 12.537950000 seconds]
    Frame Number: 173
    Frame Length: 1414 bytes (11312 bits)
    Capture Length: 1414 bytes (11312 bits)
    [Frame is marked: False]
    [Frame is ignored: False]
    [Protocols in frame: eth:ethertype:ip:tcp]
    [Coloring Rule Name: TCP]
    [Coloring Rule String: tcp]
Ethernet II, Src: AzureWaveTec_78:d7:21 (ec:2e:98:78:d7:21), Dst: Maxlinear_80:00:00 (00:50:f1:80:00:00)
    Destination: Maxlinear_80:00:00 (00:50:f1:80:00:00)
        Address: Maxlinear_80:00:00 (00:50:f1:80:00:00)
        .... ..0. .... .... .... .... = LG bit: Globally unique address (factory default)
        .... ...0 .... .... .... .... = IG bit: Individual address (unicast)
    Source: AzureWaveTec_78:d7:21 (ec:2e:98:78:d7:21)
        Address: AzureWaveTec_78:d7:21 (ec:2e:98:78:d7:21)
        .... ..0. .... .... .... .... = LG bit: Globally unique address (factory default)
        .... ...0 .... .... .... .... = IG bit: Individual address (unicast)
    Type: IPv4 (0x0800)
Internet Protocol Version 4, Src: 192.168.0.6, Dst: 5.252.32.98
    0100 .... = Version: 4
    .... 0101 = Header Length: 20 bytes (5)
    Differentiated Services Field: 0x00 (DSCP: CS0, ECN: Not-ECT)
        0000 00.. = Differentiated Services Codepoint: Default (0)
        .... ..00 = Explicit Congestion Notification: Not ECN-Capable Transport (0)
    Total Length: 1400
    Identification: 0x45a7 (17831)
    010. .... = Flags: 0x2, Don't fragment
        0... .... = Reserved bit: Not set
        .1.. .... = Don't fragment: Set
        ..0. .... = More fragments: Not set
    ...0 0000 0000 0000 = Fragment Offset: 0
    Time to Live: 128
    Protocol: TCP (6)
    Header Checksum: 0xc8cc [validation disabled]
    [Header checksum status: Unverified]
    Source Address: 192.168.0.6
    Destination Address: 5.252.32.98
Transmission Control Protocol, Src Port: 63778, Dst Port: 443, Seq: 24832, Ack: 3050, Len: 1360
    Source Port: 63778
    Destination Port: 443
    [Stream index: 7]
    [Conversation completeness: Complete, WITH_DATA (31)]
        ..0. .... = RST: Absent
        ...1 .... = FIN: Present
        .... 1... = Data: Present
        .... .1.. = ACK: Present
        .... ..1. = SYN-ACK: Present
        .... ...1 = SYN: Present
        [Completeness Flags: ·FDASS]
    [TCP Segment Len: 1360]
    Sequence Number: 24832    (relative sequence number)
    Sequence Number (raw): 3240835670
    [Next Sequence Number: 26192    (relative sequence number)]
    Acknowledgment Number: 3050    (relative ack number)
    Acknowledgment number (raw): 3540583887
    0101 .... = Header Length: 20 bytes (5)
    Flags: 0x010 (ACK)
        000. .... .... = Reserved: Not set
        ...0 .... .... = Accurate ECN: Not set
        .... 0... .... = Congestion Window Reduced: Not set
        .... .0.. .... = ECN-Echo: Not set
        .... ..0. .... = Urgent: Not set
        .... ...1 .... = Acknowledgment: Set
        .... .... 0... = Push: Not set
        .... .... .0.. = Reset: Not set
        .... .... ..0. = Syn: Not set
        .... .... ...0 = Fin: Not set
        [TCP Flags: ·······A····]
    Window: 515
    [Calculated window size: 131840]
    [Window size scaling factor: 256]
    Checksum: 0x92dc [unverified]
    [Checksum Status: Unverified]
    Urgent Pointer: 0
    [Timestamps]
        [Time since first frame in this TCP stream: 1.061605000 seconds]
        [Time since previous frame in this TCP stream: 0.000000000 seconds]
    [SEQ/ACK analysis]
        [iRTT: 0.260260000 seconds]
        [Bytes in flight: 16320]
        [Bytes sent since last PSH flag: 4080]
    TCP payload (1360 bytes)
    [Reassembled PDU in frame: 183]
    TCP segment data (1360 bytes)

No.     Time           Source                Destination           Protocol Length Info
    174 12.537950      192.168.0.6           5.252.32.98           TCP      1414   63778 → 443 [ACK] Seq=26192 Ack=3050 Win=131840 Len=1360 [TCP segment of a reassembled PDU]

Frame 174: 1414 bytes on wire (11312 bits), 1414 bytes captured (11312 bits) on interface \Device\NPF_{9DA57E6A-DB56-483D-A9F1-101740B9C29A}, id 0
    Section number: 1
    Interface id: 0 (\Device\NPF_{9DA57E6A-DB56-483D-A9F1-101740B9C29A})
        Interface name: \Device\NPF_{9DA57E6A-DB56-483D-A9F1-101740B9C29A}
        Interface description: Wi-Fi
    Encapsulation type: Ethernet (1)
    Arrival Time: Jul 10, 2024 01:01:24.520545000 Hora estándar de Argentina
    UTC Arrival Time: Jul 10, 2024 04:01:24.520545000 UTC
    Epoch Arrival Time: 1720584084.520545000
    [Time shift for this packet: 0.000000000 seconds]
    [Time delta from previous captured frame: 0.000000000 seconds]
    [Time delta from previous displayed frame: 0.000000000 seconds]
    [Time since reference or first frame: 12.537950000 seconds]
    Frame Number: 174
    Frame Length: 1414 bytes (11312 bits)
    Capture Length: 1414 bytes (11312 bits)
    [Frame is marked: False]
    [Frame is ignored: False]
    [Protocols in frame: eth:ethertype:ip:tcp]
    [Coloring Rule Name: TCP]
    [Coloring Rule String: tcp]
Ethernet II, Src: AzureWaveTec_78:d7:21 (ec:2e:98:78:d7:21), Dst: Maxlinear_80:00:00 (00:50:f1:80:00:00)
    Destination: Maxlinear_80:00:00 (00:50:f1:80:00:00)
        Address: Maxlinear_80:00:00 (00:50:f1:80:00:00)
        .... ..0. .... .... .... .... = LG bit: Globally unique address (factory default)
        .... ...0 .... .... .... .... = IG bit: Individual address (unicast)
    Source: AzureWaveTec_78:d7:21 (ec:2e:98:78:d7:21)
        Address: AzureWaveTec_78:d7:21 (ec:2e:98:78:d7:21)
        .... ..0. .... .... .... .... = LG bit: Globally unique address (factory default)
        .... ...0 .... .... .... .... = IG bit: Individual address (unicast)
    Type: IPv4 (0x0800)
Internet Protocol Version 4, Src: 192.168.0.6, Dst: 5.252.32.98
    0100 .... = Version: 4
    .... 0101 = Header Length: 20 bytes (5)
    Differentiated Services Field: 0x00 (DSCP: CS0, ECN: Not-ECT)
        0000 00.. = Differentiated Services Codepoint: Default (0)
        .... ..00 = Explicit Congestion Notification: Not ECN-Capable Transport (0)
    Total Length: 1400
    Identification: 0x45a8 (17832)
    010. .... = Flags: 0x2, Don't fragment
        0... .... = Reserved bit: Not set
        .1.. .... = Don't fragment: Set
        ..0. .... = More fragments: Not set
    ...0 0000 0000 0000 = Fragment Offset: 0
    Time to Live: 128
    Protocol: TCP (6)
    Header Checksum: 0xc8cb [validation disabled]
    [Header checksum status: Unverified]
    Source Address: 192.168.0.6
    Destination Address: 5.252.32.98
Transmission Control Protocol, Src Port: 63778, Dst Port: 443, Seq: 26192, Ack: 3050, Len: 1360
    Source Port: 63778
    Destination Port: 443
    [Stream index: 7]
    [Conversation completeness: Complete, WITH_DATA (31)]
        ..0. .... = RST: Absent
        ...1 .... = FIN: Present
        .... 1... = Data: Present
        .... .1.. = ACK: Present
        .... ..1. = SYN-ACK: Present
        .... ...1 = SYN: Present
        [Completeness Flags: ·FDASS]
    [TCP Segment Len: 1360]
    Sequence Number: 26192    (relative sequence number)
    Sequence Number (raw): 3240837030
    [Next Sequence Number: 27552    (relative sequence number)]
    Acknowledgment Number: 3050    (relative ack number)
    Acknowledgment number (raw): 3540583887
    0101 .... = Header Length: 20 bytes (5)
    Flags: 0x010 (ACK)
        000. .... .... = Reserved: Not set
        ...0 .... .... = Accurate ECN: Not set
        .... 0... .... = Congestion Window Reduced: Not set
        .... .0.. .... = ECN-Echo: Not set
        .... ..0. .... = Urgent: Not set
        .... ...1 .... = Acknowledgment: Set
        .... .... 0... = Push: Not set
        .... .... .0.. = Reset: Not set
        .... .... ..0. = Syn: Not set
        .... .... ...0 = Fin: Not set
        [TCP Flags: ·······A····]
    Window: 515
    [Calculated window size: 131840]
    [Window size scaling factor: 256]
    Checksum: 0xb52b [unverified]
    [Checksum Status: Unverified]
    Urgent Pointer: 0
    [Timestamps]
        [Time since first frame in this TCP stream: 1.061605000 seconds]
        [Time since previous frame in this TCP stream: 0.000000000 seconds]
    [SEQ/ACK analysis]
        [iRTT: 0.260260000 seconds]
        [Bytes in flight: 17680]
        [Bytes sent since last PSH flag: 5440]
    TCP payload (1360 bytes)
    [Reassembled PDU in frame: 183]
    TCP segment data (1360 bytes)

No.     Time           Source                Destination           Protocol Length Info
    175 12.537950      192.168.0.6           5.252.32.98           TCP      1414   63778 → 443 [ACK] Seq=27552 Ack=3050 Win=131840 Len=1360 [TCP segment of a reassembled PDU]

Frame 175: 1414 bytes on wire (11312 bits), 1414 bytes captured (11312 bits) on interface \Device\NPF_{9DA57E6A-DB56-483D-A9F1-101740B9C29A}, id 0
    Section number: 1
    Interface id: 0 (\Device\NPF_{9DA57E6A-DB56-483D-A9F1-101740B9C29A})
        Interface name: \Device\NPF_{9DA57E6A-DB56-483D-A9F1-101740B9C29A}
        Interface description: Wi-Fi
    Encapsulation type: Ethernet (1)
    Arrival Time: Jul 10, 2024 01:01:24.520545000 Hora estándar de Argentina
    UTC Arrival Time: Jul 10, 2024 04:01:24.520545000 UTC
    Epoch Arrival Time: 1720584084.520545000
    [Time shift for this packet: 0.000000000 seconds]
    [Time delta from previous captured frame: 0.000000000 seconds]
    [Time delta from previous displayed frame: 0.000000000 seconds]
    [Time since reference or first frame: 12.537950000 seconds]
    Frame Number: 175
    Frame Length: 1414 bytes (11312 bits)
    Capture Length: 1414 bytes (11312 bits)
    [Frame is marked: False]
    [Frame is ignored: False]
    [Protocols in frame: eth:ethertype:ip:tcp]
    [Coloring Rule Name: TCP]
    [Coloring Rule String: tcp]
Ethernet II, Src: AzureWaveTec_78:d7:21 (ec:2e:98:78:d7:21), Dst: Maxlinear_80:00:00 (00:50:f1:80:00:00)
    Destination: Maxlinear_80:00:00 (00:50:f1:80:00:00)
        Address: Maxlinear_80:00:00 (00:50:f1:80:00:00)
        .... ..0. .... .... .... .... = LG bit: Globally unique address (factory default)
        .... ...0 .... .... .... .... = IG bit: Individual address (unicast)
    Source: AzureWaveTec_78:d7:21 (ec:2e:98:78:d7:21)
        Address: AzureWaveTec_78:d7:21 (ec:2e:98:78:d7:21)
        .... ..0. .... .... .... .... = LG bit: Globally unique address (factory default)
        .... ...0 .... .... .... .... = IG bit: Individual address (unicast)
    Type: IPv4 (0x0800)
Internet Protocol Version 4, Src: 192.168.0.6, Dst: 5.252.32.98
    0100 .... = Version: 4
    .... 0101 = Header Length: 20 bytes (5)
    Differentiated Services Field: 0x00 (DSCP: CS0, ECN: Not-ECT)
        0000 00.. = Differentiated Services Codepoint: Default (0)
        .... ..00 = Explicit Congestion Notification: Not ECN-Capable Transport (0)
    Total Length: 1400
    Identification: 0x45a9 (17833)
    010. .... = Flags: 0x2, Don't fragment
        0... .... = Reserved bit: Not set
        .1.. .... = Don't fragment: Set
        ..0. .... = More fragments: Not set
    ...0 0000 0000 0000 = Fragment Offset: 0
    Time to Live: 128
    Protocol: TCP (6)
    Header Checksum: 0xc8ca [validation disabled]
    [Header checksum status: Unverified]
    Source Address: 192.168.0.6
    Destination Address: 5.252.32.98
Transmission Control Protocol, Src Port: 63778, Dst Port: 443, Seq: 27552, Ack: 3050, Len: 1360
    Source Port: 63778
    Destination Port: 443
    [Stream index: 7]
    [Conversation completeness: Complete, WITH_DATA (31)]
        ..0. .... = RST: Absent
        ...1 .... = FIN: Present
        .... 1... = Data: Present
        .... .1.. = ACK: Present
        .... ..1. = SYN-ACK: Present
        .... ...1 = SYN: Present
        [Completeness Flags: ·FDASS]
    [TCP Segment Len: 1360]
    Sequence Number: 27552    (relative sequence number)
    Sequence Number (raw): 3240838390
    [Next Sequence Number: 28912    (relative sequence number)]
    Acknowledgment Number: 3050    (relative ack number)
    Acknowledgment number (raw): 3540583887
    0101 .... = Header Length: 20 bytes (5)
    Flags: 0x010 (ACK)
        000. .... .... = Reserved: Not set
        ...0 .... .... = Accurate ECN: Not set
        .... 0... .... = Congestion Window Reduced: Not set
        .... .0.. .... = ECN-Echo: Not set
        .... ..0. .... = Urgent: Not set
        .... ...1 .... = Acknowledgment: Set
        .... .... 0... = Push: Not set
        .... .... .0.. = Reset: Not set
        .... .... ..0. = Syn: Not set
        .... .... ...0 = Fin: Not set
        [TCP Flags: ·······A····]
    Window: 515
    [Calculated window size: 131840]
    [Window size scaling factor: 256]
    Checksum: 0x1402 [unverified]
    [Checksum Status: Unverified]
    Urgent Pointer: 0
    [Timestamps]
        [Time since first frame in this TCP stream: 1.061605000 seconds]
        [Time since previous frame in this TCP stream: 0.000000000 seconds]
    [SEQ/ACK analysis]
        [iRTT: 0.260260000 seconds]
        [Bytes in flight: 19040]
        [Bytes sent since last PSH flag: 6800]
    TCP payload (1360 bytes)
    [Reassembled PDU in frame: 183]
    TCP segment data (1360 bytes)

No.     Time           Source                Destination           Protocol Length Info
    176 12.537950      192.168.0.6           5.252.32.98           TCP      1414   63778 → 443 [ACK] Seq=28912 Ack=3050 Win=131840 Len=1360 [TCP segment of a reassembled PDU]

Frame 176: 1414 bytes on wire (11312 bits), 1414 bytes captured (11312 bits) on interface \Device\NPF_{9DA57E6A-DB56-483D-A9F1-101740B9C29A}, id 0
    Section number: 1
    Interface id: 0 (\Device\NPF_{9DA57E6A-DB56-483D-A9F1-101740B9C29A})
        Interface name: \Device\NPF_{9DA57E6A-DB56-483D-A9F1-101740B9C29A}
        Interface description: Wi-Fi
    Encapsulation type: Ethernet (1)
    Arrival Time: Jul 10, 2024 01:01:24.520545000 Hora estándar de Argentina
    UTC Arrival Time: Jul 10, 2024 04:01:24.520545000 UTC
    Epoch Arrival Time: 1720584084.520545000
    [Time shift for this packet: 0.000000000 seconds]
    [Time delta from previous captured frame: 0.000000000 seconds]
    [Time delta from previous displayed frame: 0.000000000 seconds]
    [Time since reference or first frame: 12.537950000 seconds]
    Frame Number: 176
    Frame Length: 1414 bytes (11312 bits)
    Capture Length: 1414 bytes (11312 bits)
    [Frame is marked: False]
    [Frame is ignored: False]
    [Protocols in frame: eth:ethertype:ip:tcp]
    [Coloring Rule Name: TCP]
    [Coloring Rule String: tcp]
Ethernet II, Src: AzureWaveTec_78:d7:21 (ec:2e:98:78:d7:21), Dst: Maxlinear_80:00:00 (00:50:f1:80:00:00)
    Destination: Maxlinear_80:00:00 (00:50:f1:80:00:00)
        Address: Maxlinear_80:00:00 (00:50:f1:80:00:00)
        .... ..0. .... .... .... .... = LG bit: Globally unique address (factory default)
        .... ...0 .... .... .... .... = IG bit: Individual address (unicast)
    Source: AzureWaveTec_78:d7:21 (ec:2e:98:78:d7:21)
        Address: AzureWaveTec_78:d7:21 (ec:2e:98:78:d7:21)
        .... ..0. .... .... .... .... = LG bit: Globally unique address (factory default)
        .... ...0 .... .... .... .... = IG bit: Individual address (unicast)
    Type: IPv4 (0x0800)
Internet Protocol Version 4, Src: 192.168.0.6, Dst: 5.252.32.98
    0100 .... = Version: 4
    .... 0101 = Header Length: 20 bytes (5)
    Differentiated Services Field: 0x00 (DSCP: CS0, ECN: Not-ECT)
        0000 00.. = Differentiated Services Codepoint: Default (0)
        .... ..00 = Explicit Congestion Notification: Not ECN-Capable Transport (0)
    Total Length: 1400
    Identification: 0x45aa (17834)
    010. .... = Flags: 0x2, Don't fragment
        0... .... = Reserved bit: Not set
        .1.. .... = Don't fragment: Set
        ..0. .... = More fragments: Not set
    ...0 0000 0000 0000 = Fragment Offset: 0
    Time to Live: 128
    Protocol: TCP (6)
    Header Checksum: 0xc8c9 [validation disabled]
    [Header checksum status: Unverified]
    Source Address: 192.168.0.6
    Destination Address: 5.252.32.98
Transmission Control Protocol, Src Port: 63778, Dst Port: 443, Seq: 28912, Ack: 3050, Len: 1360
    Source Port: 63778
    Destination Port: 443
    [Stream index: 7]
    [Conversation completeness: Complete, WITH_DATA (31)]
        ..0. .... = RST: Absent
        ...1 .... = FIN: Present
        .... 1... = Data: Present
        .... .1.. = ACK: Present
        .... ..1. = SYN-ACK: Present
        .... ...1 = SYN: Present
        [Completeness Flags: ·FDASS]
    [TCP Segment Len: 1360]
    Sequence Number: 28912    (relative sequence number)
    Sequence Number (raw): 3240839750
    [Next Sequence Number: 30272    (relative sequence number)]
    Acknowledgment Number: 3050    (relative ack number)
    Acknowledgment number (raw): 3540583887
    0101 .... = Header Length: 20 bytes (5)
    Flags: 0x010 (ACK)
        000. .... .... = Reserved: Not set
        ...0 .... .... = Accurate ECN: Not set
        .... 0... .... = Congestion Window Reduced: Not set
        .... .0.. .... = ECN-Echo: Not set
        .... ..0. .... = Urgent: Not set
        .... ...1 .... = Acknowledgment: Set
        .... .... 0... = Push: Not set
        .... .... .0.. = Reset: Not set
        .... .... ..0. = Syn: Not set
        .... .... ...0 = Fin: Not set
        [TCP Flags: ·······A····]
    Window: 515
    [Calculated window size: 131840]
    [Window size scaling factor: 256]
    Checksum: 0xa660 [unverified]
    [Checksum Status: Unverified]
    Urgent Pointer: 0
    [Timestamps]
        [Time since first frame in this TCP stream: 1.061605000 seconds]
        [Time since previous frame in this TCP stream: 0.000000000 seconds]
    [SEQ/ACK analysis]
        [iRTT: 0.260260000 seconds]
        [Bytes in flight: 20400]
        [Bytes sent since last PSH flag: 8160]
    TCP payload (1360 bytes)
    [Reassembled PDU in frame: 183]
    TCP segment data (1360 bytes)

No.     Time           Source                Destination           Protocol Length Info
    177 12.537950      192.168.0.6           5.252.32.98           TCP      1414   63778 → 443 [ACK] Seq=30272 Ack=3050 Win=131840 Len=1360 [TCP segment of a reassembled PDU]

Frame 177: 1414 bytes on wire (11312 bits), 1414 bytes captured (11312 bits) on interface \Device\NPF_{9DA57E6A-DB56-483D-A9F1-101740B9C29A}, id 0
    Section number: 1
    Interface id: 0 (\Device\NPF_{9DA57E6A-DB56-483D-A9F1-101740B9C29A})
        Interface name: \Device\NPF_{9DA57E6A-DB56-483D-A9F1-101740B9C29A}
        Interface description: Wi-Fi
    Encapsulation type: Ethernet (1)
    Arrival Time: Jul 10, 2024 01:01:24.520545000 Hora estándar de Argentina
    UTC Arrival Time: Jul 10, 2024 04:01:24.520545000 UTC
    Epoch Arrival Time: 1720584084.520545000
    [Time shift for this packet: 0.000000000 seconds]
    [Time delta from previous captured frame: 0.000000000 seconds]
    [Time delta from previous displayed frame: 0.000000000 seconds]
    [Time since reference or first frame: 12.537950000 seconds]
    Frame Number: 177
    Frame Length: 1414 bytes (11312 bits)
    Capture Length: 1414 bytes (11312 bits)
    [Frame is marked: False]
    [Frame is ignored: False]
    [Protocols in frame: eth:ethertype:ip:tcp]
    [Coloring Rule Name: TCP]
    [Coloring Rule String: tcp]
Ethernet II, Src: AzureWaveTec_78:d7:21 (ec:2e:98:78:d7:21), Dst: Maxlinear_80:00:00 (00:50:f1:80:00:00)
    Destination: Maxlinear_80:00:00 (00:50:f1:80:00:00)
        Address: Maxlinear_80:00:00 (00:50:f1:80:00:00)
        .... ..0. .... .... .... .... = LG bit: Globally unique address (factory default)
        .... ...0 .... .... .... .... = IG bit: Individual address (unicast)
    Source: AzureWaveTec_78:d7:21 (ec:2e:98:78:d7:21)
        Address: AzureWaveTec_78:d7:21 (ec:2e:98:78:d7:21)
        .... ..0. .... .... .... .... = LG bit: Globally unique address (factory default)
        .... ...0 .... .... .... .... = IG bit: Individual address (unicast)
    Type: IPv4 (0x0800)
Internet Protocol Version 4, Src: 192.168.0.6, Dst: 5.252.32.98
    0100 .... = Version: 4
    .... 0101 = Header Length: 20 bytes (5)
    Differentiated Services Field: 0x00 (DSCP: CS0, ECN: Not-ECT)
        0000 00.. = Differentiated Services Codepoint: Default (0)
        .... ..00 = Explicit Congestion Notification: Not ECN-Capable Transport (0)
    Total Length: 1400
    Identification: 0x45ab (17835)
    010. .... = Flags: 0x2, Don't fragment
        0... .... = Reserved bit: Not set
        .1.. .... = Don't fragment: Set
        ..0. .... = More fragments: Not set
    ...0 0000 0000 0000 = Fragment Offset: 0
    Time to Live: 128
    Protocol: TCP (6)
    Header Checksum: 0xc8c8 [validation disabled]
    [Header checksum status: Unverified]
    Source Address: 192.168.0.6
    Destination Address: 5.252.32.98
Transmission Control Protocol, Src Port: 63778, Dst Port: 443, Seq: 30272, Ack: 3050, Len: 1360
    Source Port: 63778
    Destination Port: 443
    [Stream index: 7]
    [Conversation completeness: Complete, WITH_DATA (31)]
        ..0. .... = RST: Absent
        ...1 .... = FIN: Present
        .... 1... = Data: Present
        .... .1.. = ACK: Present
        .... ..1. = SYN-ACK: Present
        .... ...1 = SYN: Present
        [Completeness Flags: ·FDASS]
    [TCP Segment Len: 1360]
    Sequence Number: 30272    (relative sequence number)
    Sequence Number (raw): 3240841110
    [Next Sequence Number: 31632    (relative sequence number)]
    Acknowledgment Number: 3050    (relative ack number)
    Acknowledgment number (raw): 3540583887
    0101 .... = Header Length: 20 bytes (5)
    Flags: 0x010 (ACK)
        000. .... .... = Reserved: Not set
        ...0 .... .... = Accurate ECN: Not set
        .... 0... .... = Congestion Window Reduced: Not set
        .... .0.. .... = ECN-Echo: Not set
        .... ..0. .... = Urgent: Not set
        .... ...1 .... = Acknowledgment: Set
        .... .... 0... = Push: Not set
        .... .... .0.. = Reset: Not set
        .... .... ..0. = Syn: Not set
        .... .... ...0 = Fin: Not set
        [TCP Flags: ·······A····]
    Window: 515
    [Calculated window size: 131840]
    [Window size scaling factor: 256]
    Checksum: 0xb39d [unverified]
    [Checksum Status: Unverified]
    Urgent Pointer: 0
    [Timestamps]
        [Time since first frame in this TCP stream: 1.061605000 seconds]
        [Time since previous frame in this TCP stream: 0.000000000 seconds]
    [SEQ/ACK analysis]
        [iRTT: 0.260260000 seconds]
        [Bytes in flight: 21760]
        [Bytes sent since last PSH flag: 9520]
    TCP payload (1360 bytes)
    [Reassembled PDU in frame: 183]
    TCP segment data (1360 bytes)

No.     Time           Source                Destination           Protocol Length Info
    178 12.537950      192.168.0.6           5.252.32.98           TCP      1414   63778 → 443 [ACK] Seq=31632 Ack=3050 Win=131840 Len=1360 [TCP segment of a reassembled PDU]

Frame 178: 1414 bytes on wire (11312 bits), 1414 bytes captured (11312 bits) on interface \Device\NPF_{9DA57E6A-DB56-483D-A9F1-101740B9C29A}, id 0
    Section number: 1
    Interface id: 0 (\Device\NPF_{9DA57E6A-DB56-483D-A9F1-101740B9C29A})
        Interface name: \Device\NPF_{9DA57E6A-DB56-483D-A9F1-101740B9C29A}
        Interface description: Wi-Fi
    Encapsulation type: Ethernet (1)
    Arrival Time: Jul 10, 2024 01:01:24.520545000 Hora estándar de Argentina
    UTC Arrival Time: Jul 10, 2024 04:01:24.520545000 UTC
    Epoch Arrival Time: 1720584084.520545000
    [Time shift for this packet: 0.000000000 seconds]
    [Time delta from previous captured frame: 0.000000000 seconds]
    [Time delta from previous displayed frame: 0.000000000 seconds]
    [Time since reference or first frame: 12.537950000 seconds]
    Frame Number: 178
    Frame Length: 1414 bytes (11312 bits)
    Capture Length: 1414 bytes (11312 bits)
    [Frame is marked: False]
    [Frame is ignored: False]
    [Protocols in frame: eth:ethertype:ip:tcp]
    [Coloring Rule Name: TCP]
    [Coloring Rule String: tcp]
Ethernet II, Src: AzureWaveTec_78:d7:21 (ec:2e:98:78:d7:21), Dst: Maxlinear_80:00:00 (00:50:f1:80:00:00)
    Destination: Maxlinear_80:00:00 (00:50:f1:80:00:00)
        Address: Maxlinear_80:00:00 (00:50:f1:80:00:00)
        .... ..0. .... .... .... .... = LG bit: Globally unique address (factory default)
        .... ...0 .... .... .... .... = IG bit: Individual address (unicast)
    Source: AzureWaveTec_78:d7:21 (ec:2e:98:78:d7:21)
        Address: AzureWaveTec_78:d7:21 (ec:2e:98:78:d7:21)
        .... ..0. .... .... .... .... = LG bit: Globally unique address (factory default)
        .... ...0 .... .... .... .... = IG bit: Individual address (unicast)
    Type: IPv4 (0x0800)
Internet Protocol Version 4, Src: 192.168.0.6, Dst: 5.252.32.98
    0100 .... = Version: 4
    .... 0101 = Header Length: 20 bytes (5)
    Differentiated Services Field: 0x00 (DSCP: CS0, ECN: Not-ECT)
        0000 00.. = Differentiated Services Codepoint: Default (0)
        .... ..00 = Explicit Congestion Notification: Not ECN-Capable Transport (0)
    Total Length: 1400
    Identification: 0x45ac (17836)
    010. .... = Flags: 0x2, Don't fragment
        0... .... = Reserved bit: Not set
        .1.. .... = Don't fragment: Set
        ..0. .... = More fragments: Not set
    ...0 0000 0000 0000 = Fragment Offset: 0
    Time to Live: 128
    Protocol: TCP (6)
    Header Checksum: 0xc8c7 [validation disabled]
    [Header checksum status: Unverified]
    Source Address: 192.168.0.6
    Destination Address: 5.252.32.98
Transmission Control Protocol, Src Port: 63778, Dst Port: 443, Seq: 31632, Ack: 3050, Len: 1360
    Source Port: 63778
    Destination Port: 443
    [Stream index: 7]
    [Conversation completeness: Complete, WITH_DATA (31)]
        ..0. .... = RST: Absent
        ...1 .... = FIN: Present
        .... 1... = Data: Present
        .... .1.. = ACK: Present
        .... ..1. = SYN-ACK: Present
        .... ...1 = SYN: Present
        [Completeness Flags: ·FDASS]
    [TCP Segment Len: 1360]
    Sequence Number: 31632    (relative sequence number)
    Sequence Number (raw): 3240842470
    [Next Sequence Number: 32992    (relative sequence number)]
    Acknowledgment Number: 3050    (relative ack number)
    Acknowledgment number (raw): 3540583887
    0101 .... = Header Length: 20 bytes (5)
    Flags: 0x010 (ACK)
        000. .... .... = Reserved: Not set
        ...0 .... .... = Accurate ECN: Not set
        .... 0... .... = Congestion Window Reduced: Not set
        .... .0.. .... = ECN-Echo: Not set
        .... ..0. .... = Urgent: Not set
        .... ...1 .... = Acknowledgment: Set
        .... .... 0... = Push: Not set
        .... .... .0.. = Reset: Not set
        .... .... ..0. = Syn: Not set
        .... .... ...0 = Fin: Not set
        [TCP Flags: ·······A····]
    Window: 515
    [Calculated window size: 131840]
    [Window size scaling factor: 256]
    Checksum: 0x28c2 [unverified]
    [Checksum Status: Unverified]
    Urgent Pointer: 0
    [Timestamps]
        [Time since first frame in this TCP stream: 1.061605000 seconds]
        [Time since previous frame in this TCP stream: 0.000000000 seconds]
    [SEQ/ACK analysis]
        [iRTT: 0.260260000 seconds]
        [Bytes in flight: 23120]
        [Bytes sent since last PSH flag: 10880]
    TCP payload (1360 bytes)
    [Reassembled PDU in frame: 183]
    TCP segment data (1360 bytes)

No.     Time           Source                Destination           Protocol Length Info
    179 12.541661      5.252.32.98           192.168.0.6           TCP      60     443 → 63778 [ACK] Seq=3050 Ack=12592 Win=86528 Len=0

Frame 179: 60 bytes on wire (480 bits), 60 bytes captured (480 bits) on interface \Device\NPF_{9DA57E6A-DB56-483D-A9F1-101740B9C29A}, id 0
    Section number: 1
    Interface id: 0 (\Device\NPF_{9DA57E6A-DB56-483D-A9F1-101740B9C29A})
        Interface name: \Device\NPF_{9DA57E6A-DB56-483D-A9F1-101740B9C29A}
        Interface description: Wi-Fi
    Encapsulation type: Ethernet (1)
    Arrival Time: Jul 10, 2024 01:01:24.524256000 Hora estándar de Argentina
    UTC Arrival Time: Jul 10, 2024 04:01:24.524256000 UTC
    Epoch Arrival Time: 1720584084.524256000
    [Time shift for this packet: 0.000000000 seconds]
    [Time delta from previous captured frame: 0.003711000 seconds]
    [Time delta from previous displayed frame: 0.003711000 seconds]
    [Time since reference or first frame: 12.541661000 seconds]
    Frame Number: 179
    Frame Length: 60 bytes (480 bits)
    Capture Length: 60 bytes (480 bits)
    [Frame is marked: False]
    [Frame is ignored: False]
    [Protocols in frame: eth:ethertype:ip:tcp]
    [Coloring Rule Name: TCP]
    [Coloring Rule String: tcp]
Ethernet II, Src: Maxlinear_80:00:00 (00:50:f1:80:00:00), Dst: AzureWaveTec_78:d7:21 (ec:2e:98:78:d7:21)
    Destination: AzureWaveTec_78:d7:21 (ec:2e:98:78:d7:21)
        Address: AzureWaveTec_78:d7:21 (ec:2e:98:78:d7:21)
        .... ..0. .... .... .... .... = LG bit: Globally unique address (factory default)
        .... ...0 .... .... .... .... = IG bit: Individual address (unicast)
    Source: Maxlinear_80:00:00 (00:50:f1:80:00:00)
        Address: Maxlinear_80:00:00 (00:50:f1:80:00:00)
        .... ..0. .... .... .... .... = LG bit: Globally unique address (factory default)
        .... ...0 .... .... .... .... = IG bit: Individual address (unicast)
    Type: IPv4 (0x0800)
    Padding: 000000000000
Internet Protocol Version 4, Src: 5.252.32.98, Dst: 192.168.0.6
    0100 .... = Version: 4
    .... 0101 = Header Length: 20 bytes (5)
    Differentiated Services Field: 0x50 (DSCP: AF22, ECN: Not-ECT)
        0101 00.. = Differentiated Services Codepoint: Assured Forwarding 22 (20)
        .... ..00 = Explicit Congestion Notification: Not ECN-Capable Transport (0)
    Total Length: 40
    Identification: 0x8098 (32920)
    010. .... = Flags: 0x2, Don't fragment
        0... .... = Reserved bit: Not set
        .1.. .... = Don't fragment: Set
        ..0. .... = More fragments: Not set
    ...0 0000 0000 0000 = Fragment Offset: 0
    Time to Live: 55
    Protocol: TCP (6)
    Header Checksum: 0xdbdb [validation disabled]
    [Header checksum status: Unverified]
    Source Address: 5.252.32.98
    Destination Address: 192.168.0.6
Transmission Control Protocol, Src Port: 443, Dst Port: 63778, Seq: 3050, Ack: 12592, Len: 0
    Source Port: 443
    Destination Port: 63778
    [Stream index: 7]
    [Conversation completeness: Complete, WITH_DATA (31)]
        ..0. .... = RST: Absent
        ...1 .... = FIN: Present
        .... 1... = Data: Present
        .... .1.. = ACK: Present
        .... ..1. = SYN-ACK: Present
        .... ...1 = SYN: Present
        [Completeness Flags: ·FDASS]
    [TCP Segment Len: 0]
    Sequence Number: 3050    (relative sequence number)
    Sequence Number (raw): 3540583887
    [Next Sequence Number: 3050    (relative sequence number)]
    Acknowledgment Number: 12592    (relative ack number)
    Acknowledgment number (raw): 3240823430
    0101 .... = Header Length: 20 bytes (5)
    Flags: 0x010 (ACK)
        000. .... .... = Reserved: Not set
        ...0 .... .... = Accurate ECN: Not set
        .... 0... .... = Congestion Window Reduced: Not set
        .... .0.. .... = ECN-Echo: Not set
        .... ..0. .... = Urgent: Not set
        .... ...1 .... = Acknowledgment: Set
        .... .... 0... = Push: Not set
        .... .... .0.. = Reset: Not set
        .... .... ..0. = Syn: Not set
        .... .... ...0 = Fin: Not set
        [TCP Flags: ·······A····]
    Window: 169
    [Calculated window size: 86528]
    [Window size scaling factor: 512]
    Checksum: 0x28b7 [unverified]
    [Checksum Status: Unverified]
    Urgent Pointer: 0
    [Timestamps]
        [Time since first frame in this TCP stream: 1.065316000 seconds]
        [Time since previous frame in this TCP stream: 0.003711000 seconds]
    [SEQ/ACK analysis]
        [This is an ACK to the segment in frame: 157]
        [The RTT to ACK the segment was: 0.263067000 seconds]
        [iRTT: 0.260260000 seconds]

No.     Time           Source                Destination           Protocol Length Info
    180 12.541733      192.168.0.6           5.252.32.98           TCP      1414   63778 → 443 [ACK] Seq=32992 Ack=3050 Win=131840 Len=1360 [TCP segment of a reassembled PDU]

Frame 180: 1414 bytes on wire (11312 bits), 1414 bytes captured (11312 bits) on interface \Device\NPF_{9DA57E6A-DB56-483D-A9F1-101740B9C29A}, id 0
    Section number: 1
    Interface id: 0 (\Device\NPF_{9DA57E6A-DB56-483D-A9F1-101740B9C29A})
        Interface name: \Device\NPF_{9DA57E6A-DB56-483D-A9F1-101740B9C29A}
        Interface description: Wi-Fi
    Encapsulation type: Ethernet (1)
    Arrival Time: Jul 10, 2024 01:01:24.524328000 Hora estándar de Argentina
    UTC Arrival Time: Jul 10, 2024 04:01:24.524328000 UTC
    Epoch Arrival Time: 1720584084.524328000
    [Time shift for this packet: 0.000000000 seconds]
    [Time delta from previous captured frame: 0.000072000 seconds]
    [Time delta from previous displayed frame: 0.000072000 seconds]
    [Time since reference or first frame: 12.541733000 seconds]
    Frame Number: 180
    Frame Length: 1414 bytes (11312 bits)
    Capture Length: 1414 bytes (11312 bits)
    [Frame is marked: False]
    [Frame is ignored: False]
    [Protocols in frame: eth:ethertype:ip:tcp]
    [Coloring Rule Name: TCP]
    [Coloring Rule String: tcp]
Ethernet II, Src: AzureWaveTec_78:d7:21 (ec:2e:98:78:d7:21), Dst: Maxlinear_80:00:00 (00:50:f1:80:00:00)
    Destination: Maxlinear_80:00:00 (00:50:f1:80:00:00)
        Address: Maxlinear_80:00:00 (00:50:f1:80:00:00)
        .... ..0. .... .... .... .... = LG bit: Globally unique address (factory default)
        .... ...0 .... .... .... .... = IG bit: Individual address (unicast)
    Source: AzureWaveTec_78:d7:21 (ec:2e:98:78:d7:21)
        Address: AzureWaveTec_78:d7:21 (ec:2e:98:78:d7:21)
        .... ..0. .... .... .... .... = LG bit: Globally unique address (factory default)
        .... ...0 .... .... .... .... = IG bit: Individual address (unicast)
    Type: IPv4 (0x0800)
Internet Protocol Version 4, Src: 192.168.0.6, Dst: 5.252.32.98
    0100 .... = Version: 4
    .... 0101 = Header Length: 20 bytes (5)
    Differentiated Services Field: 0x00 (DSCP: CS0, ECN: Not-ECT)
        0000 00.. = Differentiated Services Codepoint: Default (0)
        .... ..00 = Explicit Congestion Notification: Not ECN-Capable Transport (0)
    Total Length: 1400
    Identification: 0x45ad (17837)
    010. .... = Flags: 0x2, Don't fragment
        0... .... = Reserved bit: Not set
        .1.. .... = Don't fragment: Set
        ..0. .... = More fragments: Not set
    ...0 0000 0000 0000 = Fragment Offset: 0
    Time to Live: 128
    Protocol: TCP (6)
    Header Checksum: 0xc8c6 [validation disabled]
    [Header checksum status: Unverified]
    Source Address: 192.168.0.6
    Destination Address: 5.252.32.98
Transmission Control Protocol, Src Port: 63778, Dst Port: 443, Seq: 32992, Ack: 3050, Len: 1360
    Source Port: 63778
    Destination Port: 443
    [Stream index: 7]
    [Conversation completeness: Complete, WITH_DATA (31)]
        ..0. .... = RST: Absent
        ...1 .... = FIN: Present
        .... 1... = Data: Present
        .... .1.. = ACK: Present
        .... ..1. = SYN-ACK: Present
        .... ...1 = SYN: Present
        [Completeness Flags: ·FDASS]
    [TCP Segment Len: 1360]
    Sequence Number: 32992    (relative sequence number)
    Sequence Number (raw): 3240843830
    [Next Sequence Number: 34352    (relative sequence number)]
    Acknowledgment Number: 3050    (relative ack number)
    Acknowledgment number (raw): 3540583887
    0101 .... = Header Length: 20 bytes (5)
    Flags: 0x010 (ACK)
        000. .... .... = Reserved: Not set
        ...0 .... .... = Accurate ECN: Not set
        .... 0... .... = Congestion Window Reduced: Not set
        .... .0.. .... = ECN-Echo: Not set
        .... ..0. .... = Urgent: Not set
        .... ...1 .... = Acknowledgment: Set
        .... .... 0... = Push: Not set
        .... .... .0.. = Reset: Not set
        .... .... ..0. = Syn: Not set
        .... .... ...0 = Fin: Not set
        [TCP Flags: ·······A····]
    Window: 515
    [Calculated window size: 131840]
    [Window size scaling factor: 256]
    Checksum: 0x0c0c [unverified]
    [Checksum Status: Unverified]
    Urgent Pointer: 0